{
  "updatedAt": "2026-02-19T11:56:43.896Z",
  "approval": [
    {
      "id": "appdonipsd9848d53",
      "poll_type": "approval",
      "sample_size": 1117,
      "population": "a",
      "url": "https://www.reuters.com/data/trumps-approval-rating-2025-01-21",
      "created_at": "2026-02-17",
      "start_date": "2026-02-13",
      "end_date": "2026-02-16",
      "pollster": "Ipsos",
      "answers": [
        {
          "choice": "Approve",
          "pct": 38
        },
        {
          "choice": "Disapprove",
          "pct": 60
        }
      ],
      "seat_name": null,
      "sponsors": [
        "Reuters"
      ],
      "internal": false,
      "partisan": null,
      "subject": "Donald Trump"
    },
    {
      "id": "appdonyoub369b74a",
      "poll_type": "approval",
      "sample_size": 1682,
      "population": "a",
      "url": "https://d3nkl3psvxxpe9.cloudfront.net/documents/econTabReport_usZL1Jt.pdf",
      "created_at": "2026-02-17",
      "start_date": "2026-02-13",
      "end_date": "2026-02-16",
      "pollster": "YouGov",
      "answers": [
        {
          "choice": "Approve",
          "pct": 39
        },
        {
          "choice": "Disapprove",
          "pct": 56
        }
      ],
      "seat_name": null,
      "sponsors": [
        "The Economist"
      ],
      "internal": false,
      "partisan": null,
      "subject": "Donald Trump"
    },
    {
      "id": "appdonyouc8a3e4eb",
      "poll_type": "approval",
      "sample_size": 1512,
      "population": "rv",
      "url": "https://d3nkl3psvxxpe9.cloudfront.net/documents/econTabReport_usZL1Jt.pdf",
      "created_at": "2026-02-17",
      "start_date": "2026-02-13",
      "end_date": "2026-02-16",
      "pollster": "YouGov",
      "answers": [
        {
          "choice": "Approve",
          "pct": 43
        },
        {
          "choice": "Disapprove",
          "pct": 55
        }
      ],
      "seat_name": null,
      "sponsors": [
        "The Economist"
      ],
      "internal": false,
      "partisan": null,
      "subject": "Donald Trump"
    },
    {
      "id": "appdonmor9fed4b5b",
      "poll_type": "approval",
      "sample_size": 2200,
      "population": "rv",
      "url": "https://pro.morningconsult.com/trackers/donald-trump-congress-policy-republicans-polling#02-16-2026",
      "created_at": "2026-02-18",
      "start_date": "2026-02-13",
      "end_date": "2026-02-16",
      "pollster": "Morning Consult",
      "answers": [
        {
          "choice": "Approve",
          "pct": 43
        },
        {
          "choice": "Disapprove",
          "pct": 55
        }
      ],
      "seat_name": null,
      "sponsors": [],
      "internal": false,
      "partisan": null,
      "subject": "Donald Trump"
    },
    {
      "id": "appdonqua315a942f",
      "poll_type": "approval",
      "sample_size": 1515,
      "population": "lv",
      "url": "https://drive.google.com/file/d/1oJf00_QCTUCxMvNoNnRMRKj97lQ5S5pP/view",
      "created_at": "2026-02-14",
      "start_date": "2026-02-12",
      "end_date": "2026-02-13",
      "pollster": "Quantus Insights",
      "answers": [
        {
          "choice": "Approve",
          "pct": 43
        },
        {
          "choice": "Disapprove",
          "pct": 56
        }
      ],
      "seat_name": null,
      "sponsors": [],
      "internal": false,
      "partisan": null,
      "subject": "Donald Trump"
    },
    {
      "id": "appdonrmgae3bbeb2",
      "poll_type": "approval",
      "sample_size": 3000,
      "population": "rv",
      "url": "https://napolitannews.org/jobapproval#02-12-2026",
      "created_at": "2026-02-13",
      "start_date": "2026-02-04",
      "end_date": "2026-02-12",
      "pollster": "RMG Research",
      "answers": [
        {
          "choice": "Approve",
          "pct": 47
        },
        {
          "choice": "Disapprove",
          "pct": 51
        }
      ],
      "seat_name": null,
      "sponsors": [
        "Napolitan Institute"
      ],
      "internal": false,
      "partisan": null,
      "subject": "Donald Trump"
    },
    {
      "id": "appdonyou3qg30s5c",
      "poll_type": "approval",
      "sample_size": 1704,
      "population": "a",
      "url": "https://www.yahoo.com/news/politics/article/poll-trumps-approval-rating-hits-new-low-as-immigration-backlash-grows-and-ice-withdraws-from-minnesota-204723473.html",
      "created_at": "2026-02-14",
      "start_date": "2026-02-09",
      "end_date": "2026-02-12",
      "pollster": "YouGov",
      "answers": [
        {
          "choice": "Approve",
          "pct": 38
        },
        {
          "choice": "Disapprove",
          "pct": 58
        }
      ],
      "seat_name": null,
      "sponsors": [
        "Yahoo News"
      ],
      "internal": false,
      "partisan": null,
      "subject": "Donald Trump"
    },
    {
      "id": "appdonfoc89318f13",
      "poll_type": "approval",
      "sample_size": 1148,
      "population": "a",
      "url": "https://www.focaldata.com/blog/cost-of-living-fuelling-democrat-strength-in-new-midterms-polling",
      "created_at": "2026-02-13",
      "start_date": "2026-02-10",
      "end_date": "2026-02-10",
      "pollster": "Focaldata",
      "answers": [
        {
          "choice": "Approve",
          "pct": 34
        },
        {
          "choice": "Disapprove",
          "pct": 53
        }
      ],
      "seat_name": null,
      "sponsors": [],
      "internal": false,
      "partisan": null,
      "subject": "Donald Trump"
    },
    {
      "id": "appdonthe8c0cdf81",
      "poll_type": "approval",
      "sample_size": 3003,
      "population": "rv",
      "url": "https://www.theargumentmag.com/p/the-trans-rights-backlash-is-real",
      "created_at": "2026-02-17",
      "start_date": "2026-02-04",
      "end_date": "2026-02-10",
      "pollster": "The Argument/Verasight",
      "answers": [
        {
          "choice": "Approve",
          "pct": 42
        },
        {
          "choice": "Disapprove",
          "pct": 57
        }
      ],
      "seat_name": null,
      "sponsors": [],
      "internal": false,
      "partisan": null,
      "subject": "Donald Trump"
    },
    {
      "id": "appdonyou41jqp8oy",
      "poll_type": "approval",
      "sample_size": 1551,
      "population": "rv",
      "url": "https://d3nkl3psvxxpe9.cloudfront.net/documents/econTabReport_vNnwPx2.pdf",
      "created_at": "2026-02-10",
      "start_date": "2026-02-06",
      "end_date": "2026-02-09",
      "pollster": "YouGov",
      "answers": [
        {
          "choice": "Approve",
          "pct": 40
        },
        {
          "choice": "Disapprove",
          "pct": 57
        }
      ],
      "seat_name": null,
      "sponsors": [
        "The Economist"
      ],
      "internal": false,
      "partisan": null,
      "subject": "Donald Trump"
    },
    {
      "id": "appdonmorchldwn82",
      "poll_type": "approval",
      "sample_size": 2200,
      "population": "rv",
      "url": "https://pro.morningconsult.com/trackers/donald-trump-congress-policy-republicans-polling#02-09-2026",
      "created_at": "2026-02-10",
      "start_date": "2026-02-06",
      "end_date": "2026-02-09",
      "pollster": "Morning Consult",
      "answers": [
        {
          "choice": "Approve",
          "pct": 44
        },
        {
          "choice": "Disapprove",
          "pct": 53
        }
      ],
      "seat_name": null,
      "sponsors": [],
      "internal": false,
      "partisan": null,
      "subject": "Donald Trump"
    },
    {
      "id": "appdonyou3qratawp",
      "poll_type": "approval",
      "sample_size": 1730,
      "population": "a",
      "url": "https://d3nkl3psvxxpe9.cloudfront.net/documents/econTabReport_vNnwPx2.pdf",
      "created_at": "2026-02-10",
      "start_date": "2026-02-06",
      "end_date": "2026-02-09",
      "pollster": "YouGov",
      "answers": [
        {
          "choice": "Approve",
          "pct": 37
        },
        {
          "choice": "Disapprove",
          "pct": 56
        }
      ],
      "seat_name": null,
      "sponsors": [
        "The Economist"
      ],
      "internal": false,
      "partisan": null,
      "subject": "Donald Trump"
    },
    {
      "id": "appdongba3751835c",
      "poll_type": "approval",
      "sample_size": 1000,
      "population": "rv",
      "url": "https://www.politico.com/f/?id=0000019c-4aa8-d3b5-addf-eaec955d0000",
      "created_at": "2026-02-11",
      "start_date": "2026-02-06",
      "end_date": "2026-02-09",
      "pollster": "GBAO Strategies",
      "answers": [
        {
          "choice": "Approve",
          "pct": 43
        },
        {
          "choice": "Disapprove",
          "pct": 57
        }
      ],
      "seat_name": null,
      "sponsors": [],
      "internal": false,
      "partisan": null,
      "subject": "Donald Trump"
    },
    {
      "id": "appdonap-f6c616f9",
      "poll_type": "approval",
      "sample_size": 1156,
      "population": "a",
      "url": "https://apnorc.org/wp-content/uploads/2026/02/February-2026-Topline_Immigration.pdf",
      "created_at": "2026-02-12",
      "start_date": "2026-02-05",
      "end_date": "2026-02-08",
      "pollster": "AP-NORC",
      "answers": [
        {
          "choice": "Approve",
          "pct": 36
        },
        {
          "choice": "Disapprove",
          "pct": 62
        }
      ],
      "seat_name": null,
      "sponsors": [],
      "internal": false,
      "partisan": null,
      "subject": "Donald Trump"
    },
    {
      "id": "appdonmorf0805c3f",
      "poll_type": "approval",
      "sample_size": 45000,
      "population": "a",
      "url": "https://pro.morningconsult.com/trackers/global-leader-approval#02-08-2026",
      "created_at": "2026-02-09",
      "start_date": "2026-02-02",
      "end_date": "2026-02-08",
      "pollster": "Morning Consult",
      "answers": [
        {
          "choice": "Approve",
          "pct": 40
        },
        {
          "choice": "Disapprove",
          "pct": 54
        }
      ],
      "seat_name": null,
      "sponsors": [],
      "internal": false,
      "partisan": null,
      "subject": "Donald Trump"
    },
    {
      "id": "appdonsur4f42707e",
      "poll_type": "approval",
      "sample_size": 21995,
      "population": "a",
      "url": "https://legacy.www.documentcloud.org/documents/26948008-nbc-news-decision-desk-poll-jan-feb-2026-topline",
      "created_at": "2026-02-11",
      "start_date": "2026-01-27",
      "end_date": "2026-02-06",
      "pollster": "SurveyMonkey",
      "answers": [
        {
          "choice": "Approve",
          "pct": 39
        },
        {
          "choice": "Disapprove",
          "pct": 61
        }
      ],
      "seat_name": null,
      "sponsors": [
        "NBC News Decision Desk"
      ],
      "internal": false,
      "partisan": null,
      "subject": "Donald Trump"
    },
    {
      "id": "appdonjoh2c92m9qg",
      "poll_type": "approval",
      "sample_size": 1000,
      "population": "lv",
      "url": "https://johnzogbystrategies.com/the-presidents-approval-ratings-underwater-on-overall-job-all-key-voter-issues",
      "created_at": "2026-02-10",
      "start_date": "2026-02-04",
      "end_date": "2026-02-05",
      "pollster": "John Zogby Strategies",
      "answers": [
        {
          "choice": "Approve",
          "pct": 44
        },
        {
          "choice": "Disapprove",
          "pct": 54
        }
      ],
      "seat_name": null,
      "sponsors": [],
      "internal": false,
      "partisan": null,
      "subject": "Donald Trump"
    },
    {
      "id": "appdonrmga01d24a7",
      "poll_type": "approval",
      "sample_size": 3000,
      "population": "rv",
      "url": "https://napolitannews.org/jobapproval#02-05-2026",
      "created_at": "2026-02-06",
      "start_date": "2026-01-28",
      "end_date": "2026-02-05",
      "pollster": "RMG Research",
      "answers": [
        {
          "choice": "Approve",
          "pct": 46
        },
        {
          "choice": "Disapprove",
          "pct": 53
        }
      ],
      "seat_name": null,
      "sponsors": [
        "Napolitan Institute"
      ],
      "internal": false,
      "partisan": null,
      "subject": "Donald Trump"
    },
    {
      "id": "appdonyou6lwikt2e",
      "poll_type": "approval",
      "sample_size": 1504,
      "population": "rv",
      "url": "https://d3nkl3psvxxpe9.cloudfront.net/documents/econTabReport_DDIQ8jz.pdf",
      "created_at": "2026-02-04",
      "start_date": "2026-01-30",
      "end_date": "2026-02-02",
      "pollster": "YouGov",
      "answers": [
        {
          "choice": "Approve",
          "pct": 42
        },
        {
          "choice": "Disapprove",
          "pct": 55
        }
      ],
      "seat_name": null,
      "sponsors": [
        "The Economist"
      ],
      "internal": false,
      "partisan": null,
      "subject": "Donald Trump"
    },
    {
      "id": "appdonyoueci1w1p7",
      "poll_type": "approval",
      "sample_size": 1672,
      "population": "a",
      "url": "https://d3nkl3psvxxpe9.cloudfront.net/documents/econTabReport_DDIQ8jz.pdf",
      "created_at": "2026-02-04",
      "start_date": "2026-01-30",
      "end_date": "2026-02-02",
      "pollster": "YouGov",
      "answers": [
        {
          "choice": "Approve",
          "pct": 40
        },
        {
          "choice": "Disapprove",
          "pct": 54
        }
      ],
      "seat_name": null,
      "sponsors": [
        "The Economist"
      ],
      "internal": false,
      "partisan": null,
      "subject": "Donald Trump"
    },
    {
      "id": "appdonquic9989479",
      "poll_type": "approval",
      "sample_size": 1191,
      "population": "rv",
      "url": "https://poll.qu.edu/images/polling/us/us02042026_ubad67.pdf",
      "created_at": "2026-02-04",
      "start_date": "2026-01-29",
      "end_date": "2026-02-02",
      "pollster": "Quinnipiac University",
      "answers": [
        {
          "choice": "Approve",
          "pct": 37
        },
        {
          "choice": "Disapprove",
          "pct": 56
        }
      ],
      "seat_name": null,
      "sponsors": [],
      "internal": false,
      "partisan": null,
      "subject": "Donald Trump"
    },
    {
      "id": "appdonmorsddhhhe9",
      "poll_type": "approval",
      "sample_size": 2201,
      "population": "rv",
      "url": "https://pro.morningconsult.com/trackers/donald-trump-congress-policy-republicans-polling#02-01-2026",
      "created_at": "2026-02-03",
      "start_date": "2026-01-30",
      "end_date": "2026-02-01",
      "pollster": "Morning Consult",
      "answers": [
        {
          "choice": "Approve",
          "pct": 45
        },
        {
          "choice": "Disapprove",
          "pct": 53
        }
      ],
      "seat_name": null,
      "sponsors": [],
      "internal": false,
      "partisan": null,
      "subject": "Donald Trump"
    },
    {
      "id": "appdongloisilo771",
      "poll_type": "approval",
      "sample_size": 1000,
      "population": "rv",
      "url": "https://navigatorresearch.org/wp-content/uploads/2026/02/Navigator-Update-02.04.2026.pdf",
      "created_at": "2026-02-04",
      "start_date": "2026-01-29",
      "end_date": "2026-02-01",
      "pollster": "Global Strategy Group",
      "answers": [
        {
          "choice": "Approve",
          "pct": 41
        },
        {
          "choice": "Disapprove",
          "pct": 56
        }
      ],
      "seat_name": null,
      "sponsors": [
        "Navigator Research"
      ],
      "internal": false,
      "partisan": null,
      "subject": "Donald Trump"
    },
    {
      "id": "appdonins53c3ftzs",
      "poll_type": "approval",
      "sample_size": 1000,
      "population": "lv",
      "url": "https://insideradvantage.com/insideradvantage-national-survey-trump-bounces-back-to-50-approval-nearly-60-say-melania-trump-media-coverage-is-biased",
      "created_at": "2026-02-04",
      "start_date": "2026-01-31",
      "end_date": "2026-02-01",
      "pollster": "InsiderAdvantage",
      "answers": [
        {
          "choice": "Approve",
          "pct": 50
        },
        {
          "choice": "Disapprove",
          "pct": 49
        }
      ],
      "seat_name": null,
      "sponsors": [],
      "internal": false,
      "partisan": null,
      "subject": "Donald Trump"
    },
    {
      "id": "appdonactrbvz88ez",
      "poll_type": "approval",
      "sample_size": 490,
      "population": "a",
      "url": "https://www.activote.net/trumps-approval-back-to-normal/",
      "created_at": "2026-02-01",
      "start_date": "2026-01-01",
      "end_date": "2026-01-31",
      "pollster": "ActiVote",
      "answers": [
        {
          "choice": "Approve",
          "pct": 44
        },
        {
          "choice": "Disapprove",
          "pct": 52.7
        }
      ],
      "seat_name": null,
      "sponsors": [],
      "internal": false,
      "partisan": null,
      "subject": "Donald Trump"
    },
    {
      "id": "appdonmar3305ea0f",
      "poll_type": "approval",
      "sample_size": 1326,
      "population": "rv",
      "url": "https://maristpoll.marist.edu/wp-content/uploads/2026/02/NPR_PBS-News_Marist-Poll_USA-NOS-and-Tables_202602021147.pdf",
      "created_at": "2026-02-05",
      "start_date": "2026-01-27",
      "end_date": "2026-01-30",
      "pollster": "Marist University",
      "answers": [
        {
          "choice": "Approve",
          "pct": 39
        },
        {
          "choice": "Disapprove",
          "pct": 57
        }
      ],
      "seat_name": null,
      "sponsors": [
        "NPR",
        "PBS News"
      ],
      "internal": false,
      "partisan": null,
      "subject": "Donald Trump"
    },
    {
      "id": "appdonpubfjsb1ng2",
      "poll_type": "approval",
      "sample_size": 652,
      "population": "rv",
      "url": "https://e1.nmcdn.io/assets/ppp/wp-content/uploads/2026/01/January2026NationalSurvey.pdf",
      "created_at": "2026-01-31",
      "start_date": "2026-01-29",
      "end_date": "2026-01-30",
      "pollster": "Public Policy Polling",
      "answers": [
        {
          "choice": "Approve",
          "pct": 39
        },
        {
          "choice": "Disapprove",
          "pct": 56
        }
      ],
      "seat_name": null,
      "sponsors": [],
      "internal": false,
      "partisan": null,
      "subject": "Donald Trump"
    },
    {
      "id": "appdonmarcd87fc64",
      "poll_type": "approval",
      "sample_size": 1462,
      "population": "a",
      "url": "https://maristpoll.marist.edu/wp-content/uploads/2026/02/NPR_PBS-News_Marist-Poll_USA-NOS-and-Tables_202602021147.pdf",
      "created_at": "2026-02-05",
      "start_date": "2026-01-27",
      "end_date": "2026-01-30",
      "pollster": "Marist University",
      "answers": [
        {
          "choice": "Approve",
          "pct": 39
        },
        {
          "choice": "Disapprove",
          "pct": 56
        }
      ],
      "seat_name": null,
      "sponsors": [
        "NPR",
        "PBS News"
      ],
      "internal": false,
      "partisan": null,
      "subject": "Donald Trump"
    },
    {
      "id": "appdonharrft8ggrb",
      "poll_type": "approval",
      "sample_size": 2000,
      "population": "rv",
      "url": "https://harvardharrispoll.com/wp-content/uploads/2026/02/HHP_Jan2026_KeyResults.pdf",
      "created_at": "2026-02-02",
      "start_date": "2026-01-28",
      "end_date": "2026-01-29",
      "pollster": "HarrisX/Harris Poll",
      "answers": [
        {
          "choice": "Approve",
          "pct": 45
        },
        {
          "choice": "Disapprove",
          "pct": 51
        }
      ],
      "seat_name": null,
      "sponsors": [
        "Harvard CAPS"
      ],
      "internal": false,
      "partisan": null,
      "subject": "Donald Trump"
    },
    {
      "id": "appdontipdeib22ht",
      "poll_type": "approval",
      "sample_size": 1384,
      "population": "a",
      "url": "https://issuesinsights.com/2026/02/02/despite-trumps-triumphs-his-presidential-favorability-ratings-remain-stuck-in-a-rut-ii-tipp-poll",
      "created_at": "2026-02-02",
      "start_date": "2026-01-27",
      "end_date": "2026-01-29",
      "pollster": "TIPP Insights",
      "answers": [
        {
          "choice": "Approve",
          "pct": 40
        },
        {
          "choice": "Disapprove",
          "pct": 51
        }
      ],
      "seat_name": null,
      "sponsors": [
        "Issues & Insights"
      ],
      "internal": false,
      "partisan": null,
      "subject": "Donald Trump"
    },
    {
      "id": "appdonrmg9n6vbzf5",
      "poll_type": "approval",
      "sample_size": 3000,
      "population": "rv",
      "url": "https://napolitannews.org/jobapproval#01-28-2026",
      "created_at": "2026-01-30",
      "start_date": "2026-01-21",
      "end_date": "2026-01-28",
      "pollster": "RMG Research",
      "answers": [
        {
          "choice": "Approve",
          "pct": 48
        },
        {
          "choice": "Disapprove",
          "pct": 51
        }
      ],
      "seat_name": null,
      "sponsors": [
        "Napolitan Institute"
      ],
      "internal": false,
      "partisan": null,
      "subject": "Donald Trump"
    },
    {
      "id": "appdonmarudnv4ovf",
      "poll_type": "approval",
      "sample_size": 1003,
      "population": "a",
      "url": "https://law.marquette.edu/assets/community/poll/MLSPSC30/MLSPSC30Crosstabs_NationalIssues.html",
      "created_at": "2026-02-04",
      "start_date": "2026-01-21",
      "end_date": "2026-01-28",
      "pollster": "Marquette University Law School",
      "answers": [
        {
          "choice": "Approve",
          "pct": 42
        },
        {
          "choice": "Disapprove",
          "pct": 58
        }
      ],
      "seat_name": null,
      "sponsors": [],
      "internal": false,
      "partisan": null,
      "subject": "Donald Trump"
    },
    {
      "id": "appdonmardpnnyzix",
      "poll_type": "approval",
      "sample_size": 869,
      "population": "rv",
      "url": "https://law.marquette.edu/assets/community/poll/MLSPSC30/MLSPSC30Crosstabs_NationalIssues.html",
      "created_at": "2026-02-04",
      "start_date": "2026-01-21",
      "end_date": "2026-01-28",
      "pollster": "Marquette University Law School",
      "answers": [
        {
          "choice": "Approve",
          "pct": 43
        },
        {
          "choice": "Disapprove",
          "pct": 57
        }
      ],
      "seat_name": null,
      "sponsors": [],
      "internal": false,
      "partisan": null,
      "subject": "Donald Trump"
    },
    {
      "id": "appdonthean8n5ggy",
      "poll_type": "approval",
      "sample_size": 1515,
      "population": "rv",
      "url": "https://www.theargumentmag.com/p/immigration-is-turning-into-a-disaster",
      "created_at": "2026-01-29",
      "start_date": "2026-01-26",
      "end_date": "2026-01-27",
      "pollster": "The Argument/Verasight",
      "answers": [
        {
          "choice": "Approve",
          "pct": 42
        },
        {
          "choice": "Disapprove",
          "pct": 57
        }
      ],
      "seat_name": null,
      "sponsors": [],
      "internal": false,
      "partisan": null,
      "subject": "Donald Trump"
    },
    {
      "id": "appdonips35ma8bgb",
      "poll_type": "approval",
      "sample_size": 1139,
      "population": "a",
      "url": "https://www.reuters.com/data/trumps-approval-rating-2025-01-21",
      "created_at": "2026-01-27",
      "start_date": "2026-01-23",
      "end_date": "2026-01-25",
      "pollster": "Ipsos",
      "answers": [
        {
          "choice": "Approve",
          "pct": 38
        },
        {
          "choice": "Disapprove",
          "pct": 59
        }
      ],
      "seat_name": null,
      "sponsors": [
        "Reuters"
      ],
      "internal": false,
      "partisan": null,
      "subject": "Donald Trump"
    },
    {
      "id": "appdonmorjszh6lmk",
      "poll_type": "approval",
      "sample_size": 2201,
      "population": "rv",
      "url": "https://pro.morningconsult.com/trackers/donald-trump-congress-policy-republicans-polling#01-25-2026",
      "created_at": "2026-01-27",
      "start_date": "2026-01-23",
      "end_date": "2026-01-25",
      "pollster": "Morning Consult",
      "answers": [
        {
          "choice": "Approve",
          "pct": 46
        },
        {
          "choice": "Disapprove",
          "pct": 51
        }
      ],
      "seat_name": null,
      "sponsors": [],
      "internal": false,
      "partisan": null,
      "subject": "Donald Trump"
    },
    {
      "id": "appdonbigixasarkn",
      "poll_type": "approval",
      "sample_size": 3820,
      "population": "rv",
      "url": "https://application.marketsight.com/app/ItemView.aspx?SharedFor=public%40bigdatapoll.com&SharedBy=34090&id=7464a386-37f1-447f-b5d3-b3df00061e28",
      "created_at": "2026-01-27",
      "start_date": "2026-01-22",
      "end_date": "2026-01-24",
      "pollster": "Big Data Poll",
      "answers": [
        {
          "choice": "Disapprove",
          "pct": 51.9
        },
        {
          "choice": "Approve",
          "pct": 44.8
        }
      ],
      "seat_name": null,
      "sponsors": [
        "Public Polling Project"
      ],
      "internal": false,
      "partisan": null,
      "subject": "Donald Trump"
    },
    {
      "id": "appdoncla6hf61oud",
      "poll_type": "approval",
      "sample_size": 1147,
      "population": "lv",
      "url": "https://www.claritycampaigns.com/clarity-omnibus-jan-2026",
      "created_at": "2026-01-28",
      "start_date": "2026-01-15",
      "end_date": "2026-01-22",
      "pollster": "Clarity Campaign Labs",
      "answers": [
        {
          "choice": "Disapprove",
          "pct": 56
        },
        {
          "choice": "Approve",
          "pct": 43
        }
      ],
      "seat_name": null,
      "sponsors": [],
      "internal": false,
      "partisan": null,
      "subject": "Donald Trump"
    },
    {
      "id": "appdonquazicc1jei",
      "poll_type": "approval",
      "sample_size": 1000,
      "population": "rv",
      "url": "https://v0-quantus-insights-website.vercel.app/polls/2601412-weighted-ziw7630t?tab=toplines",
      "created_at": "2026-01-22",
      "start_date": "2026-01-20",
      "end_date": "2026-01-22",
      "pollster": "Quantus Insights",
      "answers": [
        {
          "choice": "Disapprove",
          "pct": 51.6
        },
        {
          "choice": "Approve",
          "pct": 43.5
        }
      ],
      "seat_name": null,
      "sponsors": [],
      "internal": false,
      "partisan": null,
      "subject": "Donald Trump"
    },
    {
      "id": "appdonyoumv29190e",
      "poll_type": "approval",
      "sample_size": 2226,
      "population": "a",
      "url": "https://d3nkl3psvxxpe9.cloudfront.net/documents/Trump_Issue_Handling_poll_results_84DsE0W.pdf",
      "created_at": "2026-01-27",
      "start_date": "2026-01-16",
      "end_date": "2026-01-22",
      "pollster": "YouGov",
      "answers": [
        {
          "choice": "Approve",
          "pct": 38
        },
        {
          "choice": "Disapprove",
          "pct": 58
        }
      ],
      "seat_name": null,
      "sponsors": [],
      "internal": false,
      "partisan": null,
      "subject": "Donald Trump"
    },
    {
      "id": "appdonrmgq67csw6s",
      "poll_type": "approval",
      "sample_size": 3000,
      "population": "rv",
      "url": "https://napolitannews.org/jobapproval#01-21-2026",
      "created_at": "2026-01-23",
      "start_date": "2026-01-14",
      "end_date": "2026-01-21",
      "pollster": "RMG Research",
      "answers": [
        {
          "choice": "Approve",
          "pct": 47
        },
        {
          "choice": "Disapprove",
          "pct": 51
        }
      ],
      "seat_name": null,
      "sponsors": [
        "Napolitan Institute"
      ],
      "internal": false,
      "partisan": null,
      "subject": "Donald Trump"
    },
    {
      "id": "appdonvert460imor",
      "poll_type": "approval",
      "sample_size": 1532,
      "population": "a",
      "url": "https://www.gelliottmorris.com/p/new-poll-trump-slips-on-immigration",
      "created_at": "2026-01-22",
      "start_date": "2026-01-14",
      "end_date": "2026-01-20",
      "pollster": "Verasight",
      "answers": [
        {
          "choice": "Approve",
          "pct": 40
        },
        {
          "choice": "Disapprove",
          "pct": 58
        }
      ],
      "seat_name": null,
      "sponsors": [
        "Strength In Numbers"
      ],
      "internal": false,
      "partisan": null,
      "subject": "Donald Trump"
    },
    {
      "id": "appdonangoi700vnj",
      "poll_type": "approval",
      "sample_size": 1838,
      "population": "a",
      "url": "https://angusreid.org/wp-content/uploads/2026/01/2026.01.21_Trump_Year_One_USA.pdf",
      "created_at": "2026-01-22",
      "start_date": "2026-01-16",
      "end_date": "2026-01-20",
      "pollster": "Angus Reid Global",
      "answers": [
        {
          "choice": "Approve",
          "pct": 37
        },
        {
          "choice": "Disapprove",
          "pct": 56
        }
      ],
      "seat_name": null,
      "sponsors": [],
      "internal": false,
      "partisan": null,
      "subject": "Donald Trump"
    },
    {
      "id": "appdonameoqvalz70",
      "poll_type": "approval",
      "sample_size": 1100,
      "population": "a",
      "url": "https://americanresearchgroup.com/economy#01-20-2026",
      "created_at": "2026-01-22",
      "start_date": "2026-01-16",
      "end_date": "2026-01-20",
      "pollster": "American Research Group",
      "answers": [
        {
          "choice": "Approve",
          "pct": 35
        },
        {
          "choice": "Disapprove",
          "pct": 63
        }
      ],
      "seat_name": null,
      "sponsors": [],
      "internal": false,
      "partisan": null,
      "subject": "Donald Trump"
    },
    {
      "id": "appdonyouirkxj92x",
      "poll_type": "approval",
      "sample_size": 1722,
      "population": "a",
      "url": "https://d3nkl3psvxxpe9.cloudfront.net/documents/econtoplines_ZEHeJBk.pdf",
      "created_at": "2026-01-20",
      "start_date": "2026-01-16",
      "end_date": "2026-01-19",
      "pollster": "YouGov",
      "answers": [
        {
          "choice": "Approve",
          "pct": 37
        },
        {
          "choice": "Disapprove",
          "pct": 57
        }
      ],
      "seat_name": null,
      "sponsors": [
        "The Economist"
      ],
      "internal": false,
      "partisan": null,
      "subject": "Donald Trump"
    },
    {
      "id": "appdonyoubu240qb9",
      "poll_type": "approval",
      "sample_size": 1549,
      "population": "rv",
      "url": "https://d3nkl3psvxxpe9.cloudfront.net/documents/econtoplines_ZEHeJBk.pdf",
      "created_at": "2026-01-20",
      "start_date": "2026-01-16",
      "end_date": "2026-01-19",
      "pollster": "YouGov",
      "answers": [
        {
          "choice": "Approve",
          "pct": 41
        },
        {
          "choice": "Disapprove",
          "pct": 56
        }
      ],
      "seat_name": null,
      "sponsors": [
        "The Economist"
      ],
      "internal": false,
      "partisan": null,
      "subject": "Donald Trump"
    },
    {
      "id": "appdonemeb4q3cp8w",
      "poll_type": "approval",
      "sample_size": 1000,
      "population": "lv",
      "url": "https://docs.google.com/spreadsheets/d/1JN0akF_-HHyL8gVAeNm-y7r4cmyJqRsB/edit?rtpof=true&sd=true&gid=1734735931#gid=1734735931",
      "created_at": "2026-01-22",
      "start_date": "2026-01-17",
      "end_date": "2026-01-19",
      "pollster": "Emerson College",
      "answers": [
        {
          "choice": "Approve",
          "pct": 43.2
        },
        {
          "choice": "Disapprove",
          "pct": 51.3
        }
      ],
      "seat_name": null,
      "sponsors": [],
      "internal": false,
      "partisan": null,
      "subject": "Donald Trump"
    },
    {
      "id": "appdonmorw7rzelsq",
      "poll_type": "approval",
      "sample_size": 2201,
      "population": "rv",
      "url": "https://pro.morningconsult.com/trackers/donald-trump-congress-policy-republicans-polling#01-18-2026",
      "created_at": "2026-01-19",
      "start_date": "2026-01-16",
      "end_date": "2026-01-18",
      "pollster": "Morning Consult",
      "answers": [
        {
          "choice": "Approve",
          "pct": 46
        },
        {
          "choice": "Disapprove",
          "pct": 51
        }
      ],
      "seat_name": null,
      "sponsors": [],
      "internal": false,
      "partisan": null,
      "subject": "Donald Trump"
    },
    {
      "id": "appdonyou1lu1pd5c",
      "poll_type": "approval",
      "sample_size": 1095,
      "population": "a",
      "url": "https://d3nkl3psvxxpe9.cloudfront.net/documents/Evaluations_of_Trump_s_Presidency_poll_results.pdf",
      "created_at": "2026-01-20",
      "start_date": "2026-01-16",
      "end_date": "2026-01-18",
      "pollster": "YouGov",
      "answers": [
        {
          "choice": "Approve",
          "pct": 39
        },
        {
          "choice": "Disapprove",
          "pct": 57
        }
      ],
      "seat_name": null,
      "sponsors": [],
      "internal": false,
      "partisan": null,
      "subject": "Donald Trump"
    },
    {
      "id": "appdonthe9u0n6jlc",
      "poll_type": "approval",
      "sample_size": 1625,
      "population": "rv",
      "url": "https://www.nytimes.com/interactive/2026/01/22/polls/times-siena-national-poll-crosstabs.html",
      "created_at": "2026-01-22",
      "start_date": "2026-01-12",
      "end_date": "2026-01-17",
      "pollster": "The New York Times/Siena College",
      "answers": [
        {
          "choice": "Approve",
          "pct": 40
        },
        {
          "choice": "Disapprove",
          "pct": 56
        }
      ],
      "seat_name": null,
      "sponsors": [],
      "internal": false,
      "partisan": null,
      "subject": "Donald Trump"
    },
    {
      "id": "appdonyou1k2jxt9f",
      "poll_type": "approval",
      "sample_size": 2523,
      "population": "a",
      "url": "https://assets1.cbsnewsstatic.com/hub/cms/prod_cms_alt/file/2026/01/18/cdcd747f-4147-4289-813f-d555f2aca600/cbs_news_poll___january_14-16__2026.pdf",
      "created_at": "2026-01-18",
      "start_date": "2026-01-14",
      "end_date": "2026-01-16",
      "pollster": "YouGov",
      "answers": [
        {
          "choice": "Approve",
          "pct": 41
        },
        {
          "choice": "Disapprove",
          "pct": 59
        }
      ],
      "seat_name": null,
      "sponsors": [
        "CBS News"
      ],
      "internal": false,
      "partisan": null,
      "subject": "Donald Trump"
    },
    {
      "id": "appdonreskozw540d",
      "poll_type": "approval",
      "sample_size": 1002,
      "population": "a",
      "url": "https://researchco.ca/2026/01/26/amendment",
      "created_at": "2026-01-27",
      "start_date": "2026-01-13",
      "end_date": "2026-01-15",
      "pollster": "Research Co.",
      "answers": [
        {
          "choice": "Approve",
          "pct": 42
        },
        {
          "choice": "Disapprove",
          "pct": 53
        }
      ],
      "seat_name": null,
      "sponsors": [],
      "internal": false,
      "partisan": null,
      "subject": "Donald Trump"
    },
    {
      "id": "appdonrmgb1aryes0",
      "poll_type": "approval",
      "sample_size": 3000,
      "population": "rv",
      "url": "https://napolitannews.org/jobapproval#01-14-2026",
      "created_at": "2026-01-16",
      "start_date": "2026-01-07",
      "end_date": "2026-01-14",
      "pollster": "RMG Research",
      "answers": [
        {
          "choice": "Approve",
          "pct": 48
        },
        {
          "choice": "Disapprove",
          "pct": 51
        }
      ],
      "seat_name": null,
      "sponsors": [
        "Napolitan Institute"
      ],
      "internal": false,
      "partisan": null,
      "subject": "Donald Trump"
    },
    {
      "id": "appdonpubawt4qo35",
      "poll_type": "approval",
      "sample_size": 597,
      "population": "rv",
      "url": "https://drive.google.com/file/d/1iHoieThBdqtE4vH3gDLGzOI334wGWU6_/view",
      "created_at": "2026-02-04",
      "start_date": "2026-01-13",
      "end_date": "2026-01-14",
      "pollster": "Public Policy Polling",
      "answers": [
        {
          "choice": "Approve",
          "pct": 44
        },
        {
          "choice": "Disapprove",
          "pct": 52
        }
      ],
      "seat_name": null,
      "sponsors": [
        "Progress Action Fund"
      ],
      "internal": false,
      "partisan": "DEM",
      "subject": "Donald Trump"
    },
    {
      "id": "appdonipsj3ugshfw",
      "poll_type": "approval",
      "sample_size": 1217,
      "population": "a",
      "url": "https://www.ipsos.com/en-us/americans-oppose-using-military-force-take-possession-greenland",
      "created_at": "2026-01-14",
      "start_date": "2026-01-12",
      "end_date": "2026-01-13",
      "pollster": "Ipsos",
      "answers": [
        {
          "choice": "Approve",
          "pct": 41
        },
        {
          "choice": "Disapprove",
          "pct": 58
        }
      ],
      "seat_name": null,
      "sponsors": [
        "Reuters"
      ],
      "internal": false,
      "partisan": null,
      "subject": "Donald Trump"
    },
    {
      "id": "appdonmar54fsu5p4",
      "poll_type": "approval",
      "sample_size": 1408,
      "population": "a",
      "url": "https://maristpoll.marist.edu/wp-content/uploads/2026/01/Marist-Poll_USA-NOS-and-Tables_202601141623.pdf",
      "created_at": "2026-01-16",
      "start_date": "2026-01-12",
      "end_date": "2026-01-13",
      "pollster": "Marist College",
      "answers": [
        {
          "choice": "Approve",
          "pct": 38
        },
        {
          "choice": "Disapprove",
          "pct": 56
        }
      ],
      "seat_name": null,
      "sponsors": [],
      "internal": false,
      "partisan": null,
      "subject": "Donald Trump"
    },
    {
      "id": "appdonmarlfecbqcv",
      "poll_type": "approval",
      "sample_size": 1222,
      "population": "rv",
      "url": "https://maristpoll.marist.edu/wp-content/uploads/2026/01/Marist-Poll_USA-NOS-and-Tables_202601141623.pdf",
      "created_at": "2026-01-16",
      "start_date": "2026-01-12",
      "end_date": "2026-01-13",
      "pollster": "Marist College",
      "answers": [
        {
          "choice": "Approve",
          "pct": 39
        },
        {
          "choice": "Disapprove",
          "pct": 57
        }
      ],
      "seat_name": null,
      "sponsors": [],
      "internal": false,
      "partisan": null,
      "subject": "Donald Trump"
    },
    {
      "id": "appdonimpf5awf66t",
      "poll_type": "approval",
      "sample_size": 1500,
      "population": "rv",
      "url": "https://www.wsj.com/politics/elections/trump-approval-rating-economy-poll-b3a62e57",
      "created_at": "2026-01-17",
      "start_date": "2026-01-08",
      "end_date": "2026-01-13",
      "pollster": "Impact Research/National Research",
      "answers": [
        {
          "choice": "Approve",
          "pct": 45
        },
        {
          "choice": "Disapprove",
          "pct": 54
        }
      ],
      "seat_name": null,
      "sponsors": [
        "The Wall Street Journal"
      ],
      "internal": false,
      "partisan": null,
      "subject": "Donald Trump"
    },
    {
      "id": "appdonmoraglt3dhb",
      "poll_type": "approval",
      "sample_size": 2201,
      "population": "rv",
      "url": "https://pro.morningconsult.com/trackers/donald-trump-congress-policy-republicans-polling#01-12-2026",
      "created_at": "2026-01-12",
      "start_date": "2026-01-09",
      "end_date": "2026-01-12",
      "pollster": "Morning Consult",
      "answers": [
        {
          "choice": "Approve",
          "pct": 45
        },
        {
          "choice": "Disapprove",
          "pct": 53
        }
      ],
      "seat_name": null,
      "sponsors": [],
      "internal": false,
      "partisan": null,
      "subject": "Donald Trump"
    },
    {
      "id": "appdonyou2z9j8i2m",
      "poll_type": "approval",
      "sample_size": 1602,
      "population": "a",
      "url": "https://d3nkl3psvxxpe9.cloudfront.net/documents/econtoplines_YpmxDW2.pdf",
      "created_at": "2026-01-13",
      "start_date": "2026-01-09",
      "end_date": "2026-01-12",
      "pollster": "YouGov",
      "answers": [
        {
          "choice": "Approve",
          "pct": 40
        },
        {
          "choice": "Disapprove",
          "pct": 54
        }
      ],
      "seat_name": null,
      "sponsors": [
        "The Economist"
      ],
      "internal": false,
      "partisan": null,
      "subject": "Donald Trump"
    },
    {
      "id": "appdonyouk68gf9yc",
      "poll_type": "approval",
      "sample_size": 1437,
      "population": "rv",
      "url": "https://d3nkl3psvxxpe9.cloudfront.net/documents/econtoplines_YpmxDW2.pdf",
      "created_at": "2026-01-13",
      "start_date": "2026-01-09",
      "end_date": "2026-01-12",
      "pollster": "YouGov",
      "answers": [
        {
          "choice": "Approve",
          "pct": 44
        },
        {
          "choice": "Disapprove",
          "pct": 54
        }
      ],
      "seat_name": null,
      "sponsors": [
        "The Economist"
      ],
      "internal": false,
      "partisan": null,
      "subject": "Donald Trump"
    },
    {
      "id": "appdonyouaky4eul5",
      "poll_type": "approval",
      "sample_size": 1709,
      "population": "a",
      "url": "https://www.scribd.com/document/980617250/Yahoo-YouGov-ICE-Poll-January-2026",
      "created_at": "2026-01-14",
      "start_date": "2026-01-08",
      "end_date": "2026-01-12",
      "pollster": "YouGov",
      "answers": [
        {
          "choice": "Approve",
          "pct": 40
        },
        {
          "choice": "Disapprove",
          "pct": 56
        }
      ],
      "seat_name": null,
      "sponsors": [
        "Yahoo News"
      ],
      "internal": false,
      "partisan": null,
      "subject": "Donald Trump"
    },
    {
      "id": "appdonyoumypn0efn",
      "poll_type": "approval",
      "sample_size": 1149,
      "population": "rv",
      "url": "https://www.scribd.com/document/980617250/Yahoo-YouGov-ICE-Poll-January-2026",
      "created_at": "2026-01-14",
      "start_date": "2026-01-08",
      "end_date": "2026-01-12",
      "pollster": "YouGov",
      "answers": [
        {
          "choice": "Approve",
          "pct": 43
        },
        {
          "choice": "Disapprove",
          "pct": 56
        }
      ],
      "seat_name": null,
      "sponsors": [
        "Yahoo News"
      ],
      "internal": false,
      "partisan": null,
      "subject": "Donald Trump"
    },
    {
      "id": "appdonquix085r0yl",
      "poll_type": "approval",
      "sample_size": 1133,
      "population": "rv",
      "url": "https://poll.qu.edu/images/polling/us/us01142026_uphx88.pdf",
      "created_at": "2026-01-14",
      "start_date": "2026-01-08",
      "end_date": "2026-01-12",
      "pollster": "Quinnipiac University",
      "answers": [
        {
          "choice": "Approve",
          "pct": 40
        },
        {
          "choice": "Disapprove",
          "pct": 54
        }
      ],
      "seat_name": null,
      "sponsors": [],
      "internal": false,
      "partisan": null,
      "subject": "Donald Trump"
    },
    {
      "id": "appdongloawmdqqoa",
      "poll_type": "approval",
      "sample_size": 1000,
      "population": "rv",
      "url": "https://navigatorresearch.org/wp-content/uploads/2026/01/Navigator-January-1-Topline-F01.12.26.pdf",
      "created_at": "2026-01-15",
      "start_date": "2026-01-08",
      "end_date": "2026-01-12",
      "pollster": "Global Strategy Group",
      "answers": [
        {
          "choice": "Approve",
          "pct": 42
        },
        {
          "choice": "Disapprove",
          "pct": 56
        }
      ],
      "seat_name": null,
      "sponsors": [
        "Navigator Research"
      ],
      "internal": false,
      "partisan": null,
      "subject": "Donald Trump"
    },
    {
      "id": "appdoncnne20j51eu",
      "poll_type": "approval",
      "sample_size": 1209,
      "population": "a",
      "url": "https://s3.documentcloud.org/documents/26490187/cnn-poll-on-trump-at-one-year.pdf",
      "created_at": "2026-01-16",
      "start_date": "2026-01-09",
      "end_date": "2026-01-12",
      "pollster": "CNN/SSRS",
      "answers": [
        {
          "choice": "Approve",
          "pct": 39
        },
        {
          "choice": "Disapprove",
          "pct": 61
        }
      ],
      "seat_name": null,
      "sponsors": [],
      "internal": false,
      "partisan": null,
      "subject": "Donald Trump"
    },
    {
      "id": "appdoncnnva5l7lp3",
      "poll_type": "approval",
      "sample_size": null,
      "population": "rv",
      "url": "https://s3.documentcloud.org/documents/26490187/cnn-poll-on-trump-at-one-year.pdf",
      "created_at": "2026-01-16",
      "start_date": "2026-01-09",
      "end_date": "2026-01-12",
      "pollster": "CNN/SSRS",
      "answers": [
        {
          "choice": "Approve",
          "pct": 40
        },
        {
          "choice": "Disapprove",
          "pct": 59
        }
      ],
      "seat_name": null,
      "sponsors": [],
      "internal": false,
      "partisan": null,
      "subject": "Donald Trump"
    },
    {
      "id": "appdonap-rfim7rva",
      "poll_type": "approval",
      "sample_size": 1203,
      "population": "a",
      "url": "https://apnorc.org/projects/fewer-want-the-u-s-to-take-an-active-role-in-global-affairs",
      "created_at": "2026-01-14",
      "start_date": "2026-01-08",
      "end_date": "2026-01-11",
      "pollster": "AP-NORC",
      "answers": [
        {
          "choice": "Approve",
          "pct": 40
        },
        {
          "choice": "Disapprove",
          "pct": 59
        }
      ],
      "seat_name": null,
      "sponsors": [],
      "internal": false,
      "partisan": null,
      "subject": "Donald Trump"
    },
    {
      "id": "appdonrea8cllgxjw",
      "poll_type": "approval",
      "sample_size": 1500,
      "population": "rv",
      "url": "https://docsend.com/view/vnuwapsu252g3au7",
      "created_at": "2026-01-27",
      "start_date": "2026-01-09",
      "end_date": "2026-01-11",
      "pollster": "RealClear Opinion Research",
      "answers": [
        {
          "choice": "Approve",
          "pct": 40
        },
        {
          "choice": "Disapprove",
          "pct": 50
        }
      ],
      "seat_name": null,
      "sponsors": [
        "Unite America"
      ],
      "internal": false,
      "partisan": null,
      "subject": "Donald Trump"
    },
    {
      "id": "appdontip8senk9on",
      "poll_type": "approval",
      "sample_size": 1478,
      "population": "a",
      "url": "https://tippinsights.com/with-america-divided-can-trump-boost-his-approval-ratings-with-an-improving-economy-i-i-tipp-poll/",
      "created_at": "2026-01-12",
      "start_date": "2026-01-06",
      "end_date": "2026-01-09",
      "pollster": "TIPP Insights",
      "answers": [
        {
          "choice": "Approve",
          "pct": 40
        },
        {
          "choice": "Disapprove",
          "pct": 51
        }
      ],
      "seat_name": null,
      "sponsors": [
        "Issues & Insights"
      ],
      "internal": false,
      "partisan": null,
      "subject": "Donald Trump"
    },
    {
      "id": "appdonrmg8ac41jwq",
      "poll_type": "approval",
      "sample_size": 2000,
      "population": "rv",
      "url": "https://napolitannews.org/jobapproval#01-08-2026",
      "created_at": "2026-01-09",
      "start_date": "2026-01-05",
      "end_date": "2026-01-08",
      "pollster": "RMG Research",
      "answers": [
        {
          "choice": "Approve",
          "pct": 47
        },
        {
          "choice": "Disapprove",
          "pct": 51
        }
      ],
      "seat_name": null,
      "sponsors": [
        "Napolitan Institute"
      ],
      "internal": false,
      "partisan": null,
      "subject": "Donald Trump"
    },
    {
      "id": "appdonyou0zvjs45c",
      "poll_type": "approval",
      "sample_size": 2325,
      "population": "a",
      "url": "https://www.cbsnews.com/news/u-s-actions-venezuela-opinion-poll/",
      "created_at": "2026-01-08",
      "start_date": "2026-01-05",
      "end_date": "2026-01-07",
      "pollster": "YouGov",
      "answers": [
        {
          "choice": "Approve",
          "pct": 41
        },
        {
          "choice": "Disapprove",
          "pct": 59
        }
      ],
      "seat_name": null,
      "sponsors": [
        "CBS News"
      ],
      "internal": false,
      "partisan": null,
      "subject": "Donald Trump"
    },
    {
      "id": "appdonzogyf5imlik",
      "poll_type": "approval",
      "sample_size": 891,
      "population": "lv",
      "url": "https://zogbyanalytics.com/news/1232-the-zogby-poll-r-latest-likely-voter-survey-results",
      "created_at": "2026-01-14",
      "start_date": "2026-01-02",
      "end_date": "2026-01-07",
      "pollster": "Zogby Analytics",
      "answers": [
        {
          "choice": "Approve",
          "pct": 43.5
        },
        {
          "choice": "Disapprove",
          "pct": 55.1
        }
      ],
      "seat_name": null,
      "sponsors": [],
      "internal": false,
      "partisan": null,
      "subject": "Donald Trump"
    },
    {
      "id": "appdonipshtqgkk03",
      "poll_type": "approval",
      "sample_size": 1248,
      "population": "a",
      "url": "https://www.reuters.com/world/americas/only-33-americans-approve-us-strike-venezuela-reutersipsos-poll-finds-2026-01-05/",
      "created_at": "2026-01-05",
      "start_date": "2026-01-04",
      "end_date": "2026-01-05",
      "pollster": "Ipsos",
      "answers": [
        {
          "choice": "Approve",
          "pct": 42
        },
        {
          "choice": "Disapprove",
          "pct": 56
        }
      ],
      "seat_name": null,
      "sponsors": [
        "Reuters"
      ],
      "internal": false,
      "partisan": null,
      "subject": "Donald Trump"
    },
    {
      "id": "appdonyoukkhzphom",
      "poll_type": "approval",
      "sample_size": 1551,
      "population": "a",
      "url": "https://d3nkl3psvxxpe9.cloudfront.net/documents/econtoplines_EO7XvNO.pdf",
      "created_at": "2026-01-06",
      "start_date": "2026-01-02",
      "end_date": "2026-01-05",
      "pollster": "YouGov",
      "answers": [
        {
          "choice": "Approve",
          "pct": 39
        },
        {
          "choice": "Disapprove",
          "pct": 56
        }
      ],
      "seat_name": null,
      "sponsors": [
        "The Economist"
      ],
      "internal": false,
      "partisan": null,
      "subject": "Donald Trump"
    },
    {
      "id": "appdonyouxjtwkhuy",
      "poll_type": "approval",
      "sample_size": 1389,
      "population": "rv",
      "url": "https://d3nkl3psvxxpe9.cloudfront.net/documents/econtoplines_EO7XvNO.pdf",
      "created_at": "2026-01-06",
      "start_date": "2026-01-02",
      "end_date": "2026-01-05",
      "pollster": "YouGov",
      "answers": [
        {
          "choice": "Approve",
          "pct": 43
        },
        {
          "choice": "Disapprove",
          "pct": 55
        }
      ],
      "seat_name": null,
      "sponsors": [
        "The Economist"
      ],
      "internal": false,
      "partisan": null,
      "subject": "Donald Trump"
    },
    {
      "id": "appdonmor8yl39gvm",
      "poll_type": "approval",
      "sample_size": 45000,
      "population": "a",
      "url": "https://pro.morningconsult.com/trackers/global-leader-approval#01-04-2026",
      "created_at": "2026-01-06",
      "start_date": "2025-12-29",
      "end_date": "2026-01-04",
      "pollster": "Morning Consult",
      "answers": [
        {
          "choice": "Approve",
          "pct": 43
        },
        {
          "choice": "Disapprove",
          "pct": 51
        }
      ],
      "seat_name": null,
      "sponsors": [],
      "internal": false,
      "partisan": null,
      "subject": "Donald Trump"
    },
    {
      "id": "appdonmorkxajhef2",
      "poll_type": "approval",
      "sample_size": 2201,
      "population": "rv",
      "url": "https://pro.morningconsult.com/trackers/donald-trump-congress-policy-republicans-polling#01-04-2026",
      "created_at": "2026-01-06",
      "start_date": "2026-01-02",
      "end_date": "2026-01-04",
      "pollster": "Morning Consult",
      "answers": [
        {
          "choice": "Approve",
          "pct": 46
        },
        {
          "choice": "Disapprove",
          "pct": 51
        }
      ],
      "seat_name": null,
      "sponsors": [],
      "internal": false,
      "partisan": null,
      "subject": "Donald Trump"
    },
    {
      "id": "appdontheiary3a4e",
      "poll_type": "approval",
      "sample_size": 1200,
      "population": "a",
      "url": "https://cdn.prod.website-files.com/68d1c32ec01e1d1f6a86e801/6957e70d6a2531a1b867adaa_ICV%202026%20Nationwide%20250th%20Study%20Toplines%20-%20FINAL.pdf",
      "created_at": "2026-01-04",
      "start_date": "2025-12-30",
      "end_date": "2026-01-03",
      "pollster": "The Bullfinch Group",
      "answers": [
        {
          "choice": "Approve",
          "pct": 38
        },
        {
          "choice": "Disapprove",
          "pct": 58
        }
      ],
      "seat_name": null,
      "sponsors": [
        "The Independent Center"
      ],
      "internal": false,
      "partisan": null,
      "subject": "Donald Trump"
    },
    {
      "id": "appdonthefuh5rjqd",
      "poll_type": "approval",
      "sample_size": 1000,
      "population": "rv",
      "url": "https://cdn.prod.website-files.com/68d1c32ec01e1d1f6a86e801/6957e70d6a2531a1b867adaa_ICV%202026%20Nationwide%20250th%20Study%20Toplines%20-%20FINAL.pdf",
      "created_at": "2026-01-04",
      "start_date": "2025-12-30",
      "end_date": "2026-01-03",
      "pollster": "The Bullfinch Group",
      "answers": [
        {
          "choice": "Approve",
          "pct": 40
        },
        {
          "choice": "Disapprove",
          "pct": 57
        }
      ],
      "seat_name": null,
      "sponsors": [
        "The Independent Center"
      ],
      "internal": false,
      "partisan": null,
      "subject": "Donald Trump"
    },
    {
      "id": "appdonyouc0hljje6",
      "poll_type": "approval",
      "sample_size": 1550,
      "population": "a",
      "url": "https://d3nkl3psvxxpe9.cloudfront.net/documents/econTabReport_h1aYmmb.pdf",
      "created_at": "2025-12-31",
      "start_date": "2025-12-26",
      "end_date": "2025-12-29",
      "pollster": "YouGov",
      "answers": [
        {
          "choice": "Approve",
          "pct": 39
        },
        {
          "choice": "Disapprove",
          "pct": 56
        }
      ],
      "seat_name": null,
      "sponsors": [
        "The Economist"
      ],
      "internal": false,
      "partisan": null,
      "subject": "Donald Trump"
    },
    {
      "id": "appdonyouku74xlkc",
      "poll_type": "approval",
      "sample_size": 1420,
      "population": "rv",
      "url": "https://d3nkl3psvxxpe9.cloudfront.net/documents/econTabReport_h1aYmmb.pdf",
      "created_at": "2025-12-31",
      "start_date": "2025-12-26",
      "end_date": "2025-12-29",
      "pollster": "YouGov",
      "answers": [
        {
          "choice": "Approve",
          "pct": 42
        },
        {
          "choice": "Disapprove",
          "pct": 55
        }
      ],
      "seat_name": null,
      "sponsors": [
        "The Economist"
      ],
      "internal": false,
      "partisan": null,
      "subject": "Donald Trump"
    },
    {
      "id": "appdonbigkm51ihs7",
      "poll_type": "approval",
      "sample_size": 3412,
      "population": "lv",
      "url": "https://www.bigdatapoll.com/blog/trump-improves-democrats-lead-generic-ballot-in-final-poll-for-2025/",
      "created_at": "2026-01-02",
      "start_date": "2025-12-26",
      "end_date": "2025-12-28",
      "pollster": "Big Data Poll",
      "answers": [
        {
          "choice": "Approve",
          "pct": 47.3
        },
        {
          "choice": "Disapprove",
          "pct": 49.7
        }
      ],
      "seat_name": null,
      "sponsors": [
        "Public Polling Project"
      ],
      "internal": false,
      "partisan": null,
      "subject": "Donald Trump"
    },
    {
      "id": "appdontrayhnn3aqw",
      "poll_type": "approval",
      "sample_size": 1098,
      "population": "lv",
      "url": "https://www.thetrafalgargroup.org/wp-content/uploads/2025/12/National-25-Trump-Approval-Report-1228.pdf",
      "created_at": "2025-12-31",
      "start_date": "2025-12-26",
      "end_date": "2025-12-27",
      "pollster": "Trafalgar Group",
      "answers": [
        {
          "choice": "Approve",
          "pct": 50
        },
        {
          "choice": "Disapprove",
          "pct": 45
        }
      ],
      "seat_name": null,
      "sponsors": [],
      "internal": false,
      "partisan": "REP",
      "subject": "Donald Trump"
    },
    {
      "id": "appdonyouojmij7tf",
      "poll_type": "approval",
      "sample_size": 1592,
      "population": "a",
      "url": "https://d3nkl3psvxxpe9.cloudfront.net/documents/econtoplines_s4jyXBa.pdf",
      "created_at": "2025-12-24",
      "start_date": "2025-12-20",
      "end_date": "2025-12-22",
      "pollster": "YouGov",
      "answers": [
        {
          "choice": "Approve",
          "pct": 39
        },
        {
          "choice": "Disapprove",
          "pct": 57
        }
      ],
      "seat_name": null,
      "sponsors": [
        "The Economist"
      ],
      "internal": false,
      "partisan": null,
      "subject": "Donald Trump"
    },
    {
      "id": "appdonyoui3v5h7me",
      "poll_type": "approval",
      "sample_size": 1425,
      "population": "rv",
      "url": "https://d3nkl3psvxxpe9.cloudfront.net/documents/econtoplines_s4jyXBa.pdf",
      "created_at": "2025-12-24",
      "start_date": "2025-12-20",
      "end_date": "2025-12-22",
      "pollster": "YouGov",
      "answers": [
        {
          "choice": "Approve",
          "pct": 42
        },
        {
          "choice": "Disapprove",
          "pct": 56
        }
      ],
      "seat_name": null,
      "sponsors": [
        "The Economist"
      ],
      "internal": false,
      "partisan": null,
      "subject": "Donald Trump"
    },
    {
      "id": "appdonmor3h585zlb",
      "poll_type": "approval",
      "sample_size": 2203,
      "population": "rv",
      "url": "https://pro.morningconsult.com/trackers/donald-trump-congress-policy-republicans-polling#12-21-2025",
      "created_at": "2025-12-23",
      "start_date": "2025-12-19",
      "end_date": "2025-12-21",
      "pollster": "Morning Consult",
      "answers": [
        {
          "choice": "Approve",
          "pct": 45
        },
        {
          "choice": "Disapprove",
          "pct": 52
        }
      ],
      "seat_name": null,
      "sponsors": [],
      "internal": false,
      "partisan": null,
      "subject": "Donald Trump"
    },
    {
      "id": "appdonj.lxft9ej1s",
      "poll_type": "approval",
      "sample_size": 1000,
      "population": "rv",
      "url": "https://www.dailymail.co.uk/news/article-15420375/amp/donald-trump-polling-affordability-crisis.html",
      "created_at": "2026-01-02",
      "start_date": "2025-12-20",
      "end_date": "2025-12-21",
      "pollster": "J.L. Partners",
      "answers": [
        {
          "choice": "Approve",
          "pct": 43
        },
        {
          "choice": "Disapprove",
          "pct": 47
        }
      ],
      "seat_name": null,
      "sponsors": [
        "DailyMail.com"
      ],
      "internal": false,
      "partisan": null,
      "subject": "Donald Trump"
    },
    {
      "id": "appdonamewlcr0e4k",
      "poll_type": "approval",
      "sample_size": 1100,
      "population": "a",
      "url": "https://americanresearchgroup.com/economy#12-20-2025",
      "created_at": "2025-12-23",
      "start_date": "2025-12-17",
      "end_date": "2025-12-20",
      "pollster": "American Research Group",
      "answers": [
        {
          "choice": "Approve",
          "pct": 35
        },
        {
          "choice": "Disapprove",
          "pct": 62
        }
      ],
      "seat_name": null,
      "sponsors": [],
      "internal": false,
      "partisan": null,
      "subject": "Donald Trump"
    },
    {
      "id": "appdonamegancq1nl",
      "poll_type": "approval",
      "sample_size": 999,
      "population": "rv",
      "url": "https://americanresearchgroup.com/economy#12-20-2025",
      "created_at": "2025-12-23",
      "start_date": "2025-12-17",
      "end_date": "2025-12-20",
      "pollster": "American Research Group",
      "answers": [
        {
          "choice": "Approve",
          "pct": 35
        },
        {
          "choice": "Disapprove",
          "pct": 62
        }
      ],
      "seat_name": null,
      "sponsors": [],
      "internal": false,
      "partisan": null,
      "subject": "Donald Trump"
    },
    {
      "id": "appdoninslpx5pgjz",
      "poll_type": "approval",
      "sample_size": 800,
      "population": "lv",
      "url": "https://insideradvantage.com/insideradvantage-national-survey-trump-approval-at-fifty-percent/",
      "created_at": "2025-12-23",
      "start_date": "2025-12-19",
      "end_date": "2025-12-20",
      "pollster": "InsiderAdvantage",
      "answers": [
        {
          "choice": "Approve",
          "pct": 50
        },
        {
          "choice": "Disapprove",
          "pct": 41
        }
      ],
      "seat_name": null,
      "sponsors": [],
      "internal": false,
      "partisan": null,
      "subject": "Donald Trump"
    },
    {
      "id": "appdonatltcesfj19",
      "poll_type": "approval",
      "sample_size": 2315,
      "population": "a",
      "url": "https://cdn.atlasintel.org/b04a7568-81b3-478f-a785-d5e5902941d4.pdf?_gl=1*1fyq2oz*_ga*MTM0MTUwMDU0My4xNzY2MTk1NTU4*_ga_W78QD5CNP1*czE3NjYxOTU1NTckbzEkZzAkdDE3NjYxOTU5MzckajYwJGwwJGgw",
      "created_at": "2025-12-20",
      "start_date": "2025-12-15",
      "end_date": "2025-12-19",
      "pollster": "AtlasIntel",
      "answers": [
        {
          "choice": "Approve",
          "pct": 39.3
        },
        {
          "choice": "Disapprove",
          "pct": 59.6
        }
      ],
      "seat_name": null,
      "sponsors": [],
      "internal": false,
      "partisan": null,
      "subject": "Donald Trump"
    },
    {
      "id": "appdonyoucax9vfcm",
      "poll_type": "approval",
      "sample_size": 2300,
      "population": "a",
      "url": "https://www.cbsnews.com/news/opinion-poll-cost-of-living-trump#12-19-2025",
      "created_at": "2025-12-23",
      "start_date": "2025-12-17",
      "end_date": "2025-12-19",
      "pollster": "YouGov",
      "answers": [
        {
          "choice": "Approve",
          "pct": 41
        },
        {
          "choice": "Disapprove",
          "pct": 59
        }
      ],
      "seat_name": null,
      "sponsors": [
        "CBS News"
      ],
      "internal": false,
      "partisan": null,
      "subject": "Donald Trump"
    },
    {
      "id": "appdonmcl39opki8a",
      "poll_type": "approval",
      "sample_size": 1000,
      "population": "lv",
      "url": "https://mclaughlinonline.com/pols/wp-content/uploads/2025/12/National-December-Presentation-Release-12-19-25.pdf",
      "created_at": "2025-12-24",
      "start_date": "2025-12-12",
      "end_date": "2025-12-19",
      "pollster": "McLaughlin & Associates",
      "answers": [
        {
          "choice": "Approve",
          "pct": 50
        },
        {
          "choice": "Disapprove",
          "pct": 47
        }
      ],
      "seat_name": null,
      "sponsors": [],
      "internal": false,
      "partisan": null,
      "subject": "Donald Trump"
    },
    {
      "id": "appdonrmgg9kr1cyu",
      "poll_type": "approval",
      "sample_size": 3000,
      "population": "rv",
      "url": "https://napolitannews.org/jobapproval#12-18-2025",
      "created_at": "2025-12-20",
      "start_date": "2025-12-10",
      "end_date": "2025-12-18",
      "pollster": "RMG Research",
      "answers": [
        {
          "choice": "Approve",
          "pct": 50
        },
        {
          "choice": "Disapprove",
          "pct": 49
        }
      ],
      "seat_name": null,
      "sponsors": [
        "Napolitan Institute"
      ],
      "internal": false,
      "partisan": null,
      "subject": "Donald Trump"
    },
    {
      "id": "appdonsusnemxp2w5",
      "poll_type": "approval",
      "sample_size": null,
      "population": "rv",
      "url": "https://www.youtube.com/watch?app=desktop&v=-DG-SOfYlo4",
      "created_at": "2025-12-26",
      "start_date": "2025-12-09",
      "end_date": "2025-12-17",
      "pollster": "Susquehanna Polling & Research",
      "answers": [
        {
          "choice": "Approve",
          "pct": 38
        },
        {
          "choice": "Disapprove",
          "pct": 56
        }
      ],
      "seat_name": null,
      "sponsors": [],
      "internal": false,
      "partisan": null,
      "subject": "Donald Trump"
    },
    {
      "id": "appdonquamt1ersoh",
      "poll_type": "approval",
      "sample_size": 1000,
      "population": "lv",
      "url": "https://drive.google.com/file/d/14uRV2kwTVNEO4EIXGv7TCQZtmlMK0owX/view",
      "created_at": "2025-12-20",
      "start_date": "2025-12-15",
      "end_date": "2025-12-16",
      "pollster": "Quantus Insights",
      "answers": [
        {
          "choice": "Approve",
          "pct": 44
        },
        {
          "choice": "Disapprove",
          "pct": 53
        }
      ],
      "seat_name": null,
      "sponsors": [],
      "internal": false,
      "partisan": null,
      "subject": "Donald Trump"
    },
    {
      "id": "appdoneche96a4a55",
      "poll_type": "approval",
      "sample_size": 2023,
      "population": "lv",
      "url": "https://www.aarp.org/content/dam/aarp/research/topics/work-finances-retirement/financial-security-retirement/shes-the-difference-financial-security-annotated-questionnaire.doi.10.26419-2fres.01033.002.pdf",
      "created_at": "2026-02-12",
      "start_date": "2025-12-09",
      "end_date": "2025-12-16",
      "pollster": "Echelon Insights/GBAO",
      "answers": [
        {
          "choice": "Approve",
          "pct": 44
        },
        {
          "choice": "Disapprove",
          "pct": 55
        }
      ],
      "seat_name": null,
      "sponsors": [
        "AARP"
      ],
      "internal": false,
      "partisan": null,
      "subject": "Donald Trump"
    },
    {
      "id": "appdonechxaors3cs",
      "poll_type": "approval",
      "sample_size": 1011,
      "population": "lv",
      "url": "https://echelonin.wpenginepowered.com/wp-content/uploads/December-2025-Omnibus-Topline-External.pdf",
      "created_at": "2025-12-16",
      "start_date": "2025-12-11",
      "end_date": "2025-12-15",
      "pollster": "Echelon Insights",
      "answers": [
        {
          "choice": "Approve",
          "pct": 45
        },
        {
          "choice": "Disapprove",
          "pct": 55
        }
      ],
      "seat_name": null,
      "sponsors": [],
      "internal": false,
      "partisan": null,
      "subject": "Donald Trump"
    },
    {
      "id": "appdonmora3fxyfel",
      "poll_type": "approval",
      "sample_size": 2201,
      "population": "rv",
      "url": "https://pro.morningconsult.com/trackers/donald-trump-congress-policy-republicans-polling#12-15-2025",
      "created_at": "2025-12-16",
      "start_date": "2025-12-12",
      "end_date": "2025-12-15",
      "pollster": "Morning Consult",
      "answers": [
        {
          "choice": "Approve",
          "pct": 46
        },
        {
          "choice": "Disapprove",
          "pct": 52
        }
      ],
      "seat_name": null,
      "sponsors": [],
      "internal": false,
      "partisan": null,
      "subject": "Donald Trump"
    },
    {
      "id": "appdonyouvro2hbal",
      "poll_type": "approval",
      "sample_size": 1632,
      "population": "a",
      "url": "https://d3nkl3psvxxpe9.cloudfront.net/documents/econtoplines_Z19KY8S.pdf",
      "created_at": "2025-12-16",
      "start_date": "2025-12-12",
      "end_date": "2025-12-15",
      "pollster": "YouGov",
      "answers": [
        {
          "choice": "Approve",
          "pct": 42
        },
        {
          "choice": "Disapprove",
          "pct": 54
        }
      ],
      "seat_name": null,
      "sponsors": [
        "The Economist"
      ],
      "internal": false,
      "partisan": null,
      "subject": "Donald Trump"
    },
    {
      "id": "appdonyouur5qwxio",
      "poll_type": "approval",
      "sample_size": 1453,
      "population": "rv",
      "url": "https://d3nkl3psvxxpe9.cloudfront.net/documents/econtoplines_Z19KY8S.pdf",
      "created_at": "2025-12-16",
      "start_date": "2025-12-12",
      "end_date": "2025-12-15",
      "pollster": "YouGov",
      "answers": [
        {
          "choice": "Approve",
          "pct": 43
        },
        {
          "choice": "Disapprove",
          "pct": 55
        }
      ],
      "seat_name": null,
      "sponsors": [
        "The Economist"
      ],
      "internal": false,
      "partisan": null,
      "subject": "Donald Trump"
    },
    {
      "id": "appdonquisp2v5fab",
      "poll_type": "approval",
      "sample_size": 1035,
      "population": "rv",
      "url": "https://poll.qu.edu/images/polling/us/us12172025_ugli25.pdf",
      "created_at": "2025-12-18",
      "start_date": "2025-12-11",
      "end_date": "2025-12-15",
      "pollster": "Quinnipiac University",
      "answers": [
        {
          "choice": "Approve",
          "pct": 40
        },
        {
          "choice": "Disapprove",
          "pct": 54
        }
      ],
      "seat_name": null,
      "sponsors": [],
      "internal": false,
      "partisan": null,
      "subject": "Donald Trump"
    },
    {
      "id": "appdonbeajjs54gu1",
      "poll_type": "approval",
      "sample_size": 1001,
      "population": "rv",
      "url": "https://www.foxnews.com/politics/fox-news-poll-prices-pinch-voters-see-trump-focused-elsewhere",
      "created_at": "2025-12-18",
      "start_date": "2025-12-12",
      "end_date": "2025-12-15",
      "pollster": "Beacon Research/Shaw & Co. Research",
      "answers": [
        {
          "choice": "Approve",
          "pct": 44
        },
        {
          "choice": "Disapprove",
          "pct": 56
        }
      ],
      "seat_name": null,
      "sponsors": [
        "Fox News"
      ],
      "internal": false,
      "partisan": null,
      "subject": "Donald Trump"
    },
    {
      "id": "appdoneme0aayndhd",
      "poll_type": "approval",
      "sample_size": 1000,
      "population": "rv",
      "url": "https://docs.google.com/spreadsheets/d/1ijYCY9YJ_NZhP0lqQxdzXBFrCemfeQ_2/edit?gid=2139865723#gid=2139865723",
      "created_at": "2025-12-18",
      "start_date": "2025-12-14",
      "end_date": "2025-12-15",
      "pollster": "Emerson College",
      "answers": [
        {
          "choice": "Approve",
          "pct": 41
        },
        {
          "choice": "Disapprove",
          "pct": 50
        }
      ],
      "seat_name": null,
      "sponsors": [],
      "internal": false,
      "partisan": null,
      "subject": "Donald Trump"
    },
    {
      "id": "appdongallbzex0uj",
      "poll_type": "approval",
      "sample_size": 1016,
      "population": "a",
      "url": "https://news.gallup.com/poll/700241/americans-end-year-gloomy-mood.aspx",
      "created_at": "2025-12-23",
      "start_date": "2025-12-01",
      "end_date": "2025-12-15",
      "pollster": "Gallup",
      "answers": [
        {
          "choice": "Approve",
          "pct": 36
        },
        {
          "choice": "Disapprove",
          "pct": 59
        }
      ],
      "seat_name": null,
      "sponsors": [],
      "internal": false,
      "partisan": null,
      "subject": "Donald Trump"
    },
    {
      "id": "appdonmorn5a90f8e",
      "poll_type": "approval",
      "sample_size": 45000,
      "population": "a",
      "url": "https://pro.morningconsult.com/trackers/global-leader-approval#12-14-2025",
      "created_at": "2025-12-16",
      "start_date": "2025-12-08",
      "end_date": "2025-12-14",
      "pollster": "Morning Consult",
      "answers": [
        {
          "choice": "Approve",
          "pct": 43
        },
        {
          "choice": "Disapprove",
          "pct": 51
        }
      ],
      "seat_name": null,
      "sponsors": [],
      "internal": false,
      "partisan": null,
      "subject": "Donald Trump"
    },
    {
      "id": "appdontav1nfwx93z",
      "poll_type": "approval",
      "sample_size": 1247,
      "population": "lv",
      "url": "https://cdn.prod.website-files.com/663a60b91deeae06e8ae1d1c/6942f9f6c7ed0499b17454ea_Rainey%20December%20Omnibus%20Toplines.pdf",
      "created_at": "2025-12-18",
      "start_date": "2025-12-13",
      "end_date": "2025-12-13",
      "pollster": "Tavern Research",
      "answers": [
        {
          "choice": "Approve",
          "pct": 43
        },
        {
          "choice": "Disapprove",
          "pct": 54
        }
      ],
      "seat_name": null,
      "sponsors": [
        "The Rainey Center"
      ],
      "internal": false,
      "partisan": null,
      "subject": "Donald Trump"
    },
    {
      "id": "appdonbigd0zlm9o0",
      "poll_type": "approval",
      "sample_size": 3004,
      "population": "rv",
      "url": "https://application.marketsight.com/app/ItemView.aspx?SharedFor=public%40bigdatapoll.com&SharedBy=34090&id=d44d9751-22bd-489a-a372-b3b3002c437f",
      "created_at": "2025-12-16",
      "start_date": "2025-12-10",
      "end_date": "2025-12-12",
      "pollster": "Big Data Poll",
      "answers": [
        {
          "choice": "Approve",
          "pct": 47
        },
        {
          "choice": "Disapprove",
          "pct": 49.9
        }
      ],
      "seat_name": null,
      "sponsors": [
        "Public Polling Project"
      ],
      "internal": false,
      "partisan": null,
      "subject": "Donald Trump"
    },
    {
      "id": "appdonrmgpa7utfk5",
      "poll_type": "approval",
      "sample_size": 3000,
      "population": "rv",
      "url": "https://napolitannews.org/jobapproval#12-11-2025",
      "created_at": "2025-12-12",
      "start_date": "2025-12-03",
      "end_date": "2025-12-11",
      "pollster": "RMG Research",
      "answers": [
        {
          "choice": "Approve",
          "pct": 47
        },
        {
          "choice": "Disapprove",
          "pct": 51
        }
      ],
      "seat_name": null,
      "sponsors": [
        "Napolitan Institute"
      ],
      "internal": false,
      "partisan": null,
      "subject": "Donald Trump"
    },
    {
      "id": "appdonclaqjqb0jq5",
      "poll_type": "approval",
      "sample_size": 1000,
      "population": "lv",
      "url": "https://www.claritycampaigns.com/clarity-omnibus-dec-2025",
      "created_at": "2025-12-17",
      "start_date": "2025-12-04",
      "end_date": "2025-12-11",
      "pollster": "Clarity Campaign Labs",
      "answers": [
        {
          "choice": "Approve",
          "pct": 44
        },
        {
          "choice": "Disapprove",
          "pct": 55
        }
      ],
      "seat_name": null,
      "sponsors": [],
      "internal": false,
      "partisan": null,
      "subject": "Donald Trump"
    },
    {
      "id": "appdonmarovht9lrh",
      "poll_type": "approval",
      "sample_size": 1440,
      "population": "a",
      "url": "https://maristpoll.marist.edu/wp-content/uploads/2025/12/NPR_PBS-News_Marist-Poll_202512121052-1.pdf",
      "created_at": "2025-12-17",
      "start_date": "2025-12-08",
      "end_date": "2025-12-11",
      "pollster": "Marist College",
      "answers": [
        {
          "choice": "Approve",
          "pct": 38
        },
        {
          "choice": "Disapprove",
          "pct": 54
        }
      ],
      "seat_name": null,
      "sponsors": [
        "NPR/PBS News"
      ],
      "internal": false,
      "partisan": null,
      "subject": "Donald Trump"
    },
    {
      "id": "appdonmar0wmky3hk",
      "poll_type": "approval",
      "sample_size": 1261,
      "population": "rv",
      "url": "https://maristpoll.marist.edu/wp-content/uploads/2025/12/NPR_PBS-News_Marist-Poll_202512121052-1.pdf",
      "created_at": "2025-12-17",
      "start_date": "2025-12-08",
      "end_date": "2025-12-11",
      "pollster": "Marist College",
      "answers": [
        {
          "choice": "Approve",
          "pct": 40
        },
        {
          "choice": "Disapprove",
          "pct": 55
        }
      ],
      "seat_name": null,
      "sponsors": [
        "NPR/PBS News"
      ],
      "internal": false,
      "partisan": null,
      "subject": "Donald Trump"
    },
    {
      "id": "appdontav4tnge0fu",
      "poll_type": "approval",
      "sample_size": 1567,
      "population": "lv",
      "url": "https://www.searchlightinstitute.org/research/voters-want-a-fairer-deal-for-workers",
      "created_at": "2025-12-12",
      "start_date": "2025-12-09",
      "end_date": "2025-12-10",
      "pollster": "Tavern Research",
      "answers": [
        {
          "choice": "Approve",
          "pct": 45
        },
        {
          "choice": "Disapprove",
          "pct": 53
        }
      ],
      "seat_name": null,
      "sponsors": [
        "Searchlight Institute"
      ],
      "internal": false,
      "partisan": null,
      "subject": "Donald Trump"
    },
    {
      "id": "appdonipshu4scfoz",
      "poll_type": "approval",
      "sample_size": 4434,
      "population": "a",
      "url": "https://www.reuters.com/world/trump-approval-rating-rises-republicans-back-cost-of-living-efforts-2025-12-09/",
      "created_at": "2025-12-09",
      "start_date": "2025-12-03",
      "end_date": "2025-12-08",
      "pollster": "Ipsos",
      "answers": [
        {
          "choice": "Approve",
          "pct": 41
        },
        {
          "choice": "Disapprove",
          "pct": 57
        }
      ],
      "seat_name": null,
      "sponsors": [
        "Reuters"
      ],
      "internal": false,
      "partisan": null,
      "subject": "Donald Trump"
    },
    {
      "id": "appdonyoutravnrua",
      "poll_type": "approval",
      "sample_size": 1530,
      "population": "a",
      "url": "https://d3nkl3psvxxpe9.cloudfront.net/documents/econtoplines_IoqnUWW.pdf",
      "created_at": "2025-12-09",
      "start_date": "2025-12-05",
      "end_date": "2025-12-08",
      "pollster": "YouGov",
      "answers": [
        {
          "choice": "Approve",
          "pct": 41
        },
        {
          "choice": "Disapprove",
          "pct": 55
        }
      ],
      "seat_name": null,
      "sponsors": [
        "The Economist"
      ],
      "internal": false,
      "partisan": null,
      "subject": "Donald Trump"
    },
    {
      "id": "appdonyoupyheneas",
      "poll_type": "approval",
      "sample_size": 1380,
      "population": "rv",
      "url": "https://d3nkl3psvxxpe9.cloudfront.net/documents/econtoplines_IoqnUWW.pdf",
      "created_at": "2025-12-09",
      "start_date": "2025-12-05",
      "end_date": "2025-12-08",
      "pollster": "YouGov",
      "answers": [
        {
          "choice": "Approve",
          "pct": 43
        },
        {
          "choice": "Disapprove",
          "pct": 54
        }
      ],
      "seat_name": null,
      "sponsors": [
        "The Economist"
      ],
      "internal": false,
      "partisan": null,
      "subject": "Donald Trump"
    },
    {
      "id": "appdonap-av1wxkux",
      "poll_type": "approval",
      "sample_size": 1146,
      "population": "a",
      "url": "https://apnorc.org/projects/trumps-approval-rating-slips-on-the-economy-and-immigration#12-08-2025",
      "created_at": "2025-12-11",
      "start_date": "2025-12-04",
      "end_date": "2025-12-08",
      "pollster": "AP-NORC",
      "answers": [
        {
          "choice": "Approve",
          "pct": 36
        },
        {
          "choice": "Disapprove",
          "pct": 61
        }
      ],
      "seat_name": null,
      "sponsors": [],
      "internal": false,
      "partisan": null,
      "subject": "Donald Trump"
    },
    {
      "id": "appdonglou4oou1cy",
      "poll_type": "approval",
      "sample_size": 1000,
      "population": "rv",
      "url": "https://navigatorresearch.org/wp-content/uploads/2025/12/Navigator-Topline-F12.08.25.pdf",
      "created_at": "2025-12-12",
      "start_date": "2025-12-04",
      "end_date": "2025-12-08",
      "pollster": "Global Strategy Group",
      "answers": [
        {
          "choice": "Approve",
          "pct": 42
        },
        {
          "choice": "Disapprove",
          "pct": 56
        }
      ],
      "seat_name": null,
      "sponsors": [
        "Navigator Research"
      ],
      "internal": false,
      "partisan": null,
      "subject": "Donald Trump"
    },
    {
      "id": "appdonsurn8scm1gq",
      "poll_type": "approval",
      "sample_size": 20252,
      "population": "a",
      "url": "https://www.documentcloud.org/documents/26376521-nbc-news-decision-desk-poll-nov-dec-2025-topline/",
      "created_at": "2025-12-14",
      "start_date": "2025-11-20",
      "end_date": "2025-12-08",
      "pollster": "SurveyMonkey",
      "answers": [
        {
          "choice": "Approve",
          "pct": 42
        },
        {
          "choice": "Disapprove",
          "pct": 58
        }
      ],
      "seat_name": null,
      "sponsors": [
        "NBC News Decision Desk"
      ],
      "internal": false,
      "partisan": null,
      "subject": "Donald Trump"
    },
    {
      "id": "appdonhar6a2d6vpn",
      "poll_type": "approval",
      "sample_size": 1000,
      "population": "a",
      "url": "https://fm.cnbc.com/applications/cnbc.com/resources/editorialfiles/2025/12/16/TOPLINES_250313_CNBC_AAES_Q4_2025_new.pdf",
      "created_at": "2025-12-18",
      "start_date": "2025-12-04",
      "end_date": "2025-12-08",
      "pollster": "Hart Research Associates/Public Opinion Strategies",
      "answers": [
        {
          "choice": "Approve",
          "pct": 45
        },
        {
          "choice": "Disapprove",
          "pct": 52
        }
      ],
      "seat_name": null,
      "sponsors": [
        "CNBC"
      ],
      "internal": false,
      "partisan": null,
      "subject": "Donald Trump"
    },
    {
      "id": "appdonmors3dmfvcm",
      "poll_type": "approval",
      "sample_size": 2201,
      "population": "rv",
      "url": "https://pro.morningconsult.com/trackers/donald-trump-congress-policy-republicans-polling#12-07-2025",
      "created_at": "2025-12-09",
      "start_date": "2025-12-05",
      "end_date": "2025-12-07",
      "pollster": "Morning Consult",
      "answers": [
        {
          "choice": "Approve",
          "pct": 45
        },
        {
          "choice": "Disapprove",
          "pct": 52
        }
      ],
      "seat_name": null,
      "sponsors": [],
      "internal": false,
      "partisan": null,
      "subject": "Donald Trump"
    },
    {
      "id": "appdonjohx3xwt1zv",
      "poll_type": "approval",
      "sample_size": 1000,
      "population": "lv",
      "url": "https://johnzogbystrategies.com/wp-content/uploads/2025/12/Outlook-2026-Is-the-President-Bleeding-Independents_.html",
      "created_at": "2025-12-11",
      "start_date": "2025-12-05",
      "end_date": "2025-12-07",
      "pollster": "John Zogby Strategies",
      "answers": [
        {
          "choice": "Approve",
          "pct": 46
        },
        {
          "choice": "Disapprove",
          "pct": 52
        }
      ],
      "seat_name": null,
      "sponsors": [],
      "internal": false,
      "partisan": null,
      "subject": "Donald Trump"
    },
    {
      "id": "appdonquao0t63caq",
      "poll_type": "approval",
      "sample_size": 1000,
      "population": "rv",
      "url": "https://drive.google.com/file/d/1cOyOMwoFoYuvZtAYFAuO1M9FIK7xenv7/view",
      "created_at": "2025-12-06",
      "start_date": "2025-12-04",
      "end_date": "2025-12-05",
      "pollster": "Quantus Insights",
      "answers": [
        {
          "choice": "Approve",
          "pct": 43
        },
        {
          "choice": "Disapprove",
          "pct": 53
        }
      ],
      "seat_name": null,
      "sponsors": [],
      "internal": false,
      "partisan": null,
      "subject": "Donald Trump"
    },
    {
      "id": "appdonj.l6tp8q5sk",
      "poll_type": "approval",
      "sample_size": 1000,
      "population": "rv",
      "url": "https://jlpartners.com/nationwide-registered-voters-december-2025",
      "created_at": "2025-12-08",
      "start_date": "2025-12-03",
      "end_date": "2025-12-05",
      "pollster": "J.L. Partners",
      "answers": [
        {
          "choice": "Approve",
          "pct": 44
        },
        {
          "choice": "Disapprove",
          "pct": 48
        }
      ],
      "seat_name": null,
      "sponsors": [
        "DailyMail.com"
      ],
      "internal": false,
      "partisan": null,
      "subject": "Donald Trump"
    },
    {
      "id": "appdonrmgebwf33rk",
      "poll_type": "approval",
      "sample_size": 3000,
      "population": "rv",
      "url": "https://napolitannews.org/jobapproval#12-04-2025",
      "created_at": "2025-12-05",
      "start_date": "2025-11-19",
      "end_date": "2025-12-04",
      "pollster": "RMG Research",
      "answers": [
        {
          "choice": "Approve",
          "pct": 45
        },
        {
          "choice": "Disapprove",
          "pct": 53
        }
      ],
      "seat_name": null,
      "sponsors": [
        "Napolitan Institute"
      ],
      "internal": false,
      "partisan": null,
      "subject": "Donald Trump"
    },
    {
      "id": "appdonharmx0jungg",
      "poll_type": "approval",
      "sample_size": 2204,
      "population": "rv",
      "url": "https://harvardharrispoll.com/wp-content/uploads/2025/12/HHP_Dec2025_KeyFindings.pdf",
      "created_at": "2025-12-08",
      "start_date": "2025-12-04",
      "end_date": "2025-12-04",
      "pollster": "HarrisX/Harris Poll",
      "answers": [
        {
          "choice": "Approve",
          "pct": 47
        },
        {
          "choice": "Disapprove",
          "pct": 49
        }
      ],
      "seat_name": null,
      "sponsors": [
        "Harvard CAPS"
      ],
      "internal": false,
      "partisan": null,
      "subject": "Donald Trump"
    },
    {
      "id": "appdonyouhq526g3r",
      "poll_type": "approval",
      "sample_size": 1628,
      "population": "a",
      "url": "https://d3nkl3psvxxpe9.cloudfront.net/documents/econtoplines_neyUICe.pdf",
      "created_at": "2025-12-02",
      "start_date": "2025-11-28",
      "end_date": "2025-12-01",
      "pollster": "YouGov",
      "answers": [
        {
          "choice": "Approve",
          "pct": 39
        },
        {
          "choice": "Disapprove",
          "pct": 58
        }
      ],
      "seat_name": null,
      "sponsors": [
        "The Economist"
      ],
      "internal": false,
      "partisan": null,
      "subject": "Donald Trump"
    },
    {
      "id": "appdonyou6u52np4v",
      "poll_type": "approval",
      "sample_size": 1456,
      "population": "rv",
      "url": "https://d3nkl3psvxxpe9.cloudfront.net/documents/econtoplines_neyUICe.pdf",
      "created_at": "2025-12-02",
      "start_date": "2025-11-28",
      "end_date": "2025-12-01",
      "pollster": "YouGov",
      "answers": [
        {
          "choice": "Approve",
          "pct": 42
        },
        {
          "choice": "Disapprove",
          "pct": 56
        }
      ],
      "seat_name": null,
      "sponsors": [
        "The Economist"
      ],
      "internal": false,
      "partisan": null,
      "subject": "Donald Trump"
    },
    {
      "id": "appdonbig3682ix8t",
      "poll_type": "approval",
      "sample_size": 2008,
      "population": "rv",
      "url": "https://www.bigdatapoll.com/blog/trumps-third-world-immigration-moratorium-widely-popular/",
      "created_at": "2025-12-03",
      "start_date": "2025-11-28",
      "end_date": "2025-12-01",
      "pollster": "Big Data Poll",
      "answers": [
        {
          "choice": "Approve",
          "pct": 45
        },
        {
          "choice": "Disapprove",
          "pct": 51
        }
      ],
      "seat_name": null,
      "sponsors": [
        "Public Polling Project"
      ],
      "internal": false,
      "partisan": null,
      "subject": "Donald Trump"
    },
    {
      "id": "appdonmory8j7ijsc",
      "poll_type": "approval",
      "sample_size": 2200,
      "population": "rv",
      "url": "https://pro.morningconsult.com/trackers/donald-trump-congress-policy-republicans-polling#11-30-2025",
      "created_at": "2025-12-02",
      "start_date": "2025-11-26",
      "end_date": "2025-11-30",
      "pollster": "Morning Consult",
      "answers": [
        {
          "choice": "Approve",
          "pct": 45
        },
        {
          "choice": "Disapprove",
          "pct": 52
        }
      ],
      "seat_name": null,
      "sponsors": [],
      "internal": false,
      "partisan": null,
      "subject": "Donald Trump"
    },
    {
      "id": "appdonactomat29jp",
      "poll_type": "approval",
      "sample_size": 568,
      "population": "a",
      "url": "https://www.activote.net/trumps-approval-takes-a-big-hit/",
      "created_at": "2025-12-02",
      "start_date": "2025-11-01",
      "end_date": "2025-11-30",
      "pollster": "ActiVote",
      "answers": [
        {
          "choice": "Approve",
          "pct": 41
        },
        {
          "choice": "Disapprove",
          "pct": 55
        }
      ],
      "seat_name": null,
      "sponsors": [],
      "internal": false,
      "partisan": null,
      "subject": "Donald Trump"
    },
    {
      "id": "appdontiponwz5p47",
      "poll_type": "approval",
      "sample_size": 1483,
      "population": "a",
      "url": "https://issuesinsights.com/2025/12/01/after-brief-decline-trump-leadership-gauges-regain-lost-ground-in-december-ii-tipp-poll/",
      "created_at": "2025-12-01",
      "start_date": "2025-11-25",
      "end_date": "2025-11-29",
      "pollster": "TIPP Insights",
      "answers": [
        {
          "choice": "Approve",
          "pct": 43
        },
        {
          "choice": "Disapprove",
          "pct": 47
        }
      ],
      "seat_name": null,
      "sponsors": [
        "Issues & Insights"
      ],
      "internal": false,
      "partisan": null,
      "subject": "Donald Trump"
    },
    {
      "id": "appdongba9yclojzj",
      "poll_type": "approval",
      "sample_size": 2000,
      "population": "rv",
      "url": "https://www.thirdway.org/memo/food-medicine-fuel-for-a-wave",
      "created_at": "2025-12-28",
      "start_date": "2025-11-19",
      "end_date": "2025-11-26",
      "pollster": "GBAO Strategies",
      "answers": [
        {
          "choice": "Approve",
          "pct": 43
        },
        {
          "choice": "Disapprove",
          "pct": 56
        }
      ],
      "seat_name": null,
      "sponsors": [
        "Third Way"
      ],
      "internal": false,
      "partisan": null,
      "subject": "Donald Trump"
    },
    {
      "id": "appdongal0qsemjjl",
      "poll_type": "approval",
      "sample_size": 1321,
      "population": "a",
      "url": "https://news.gallup.com/poll/699221/trump-approval-rating-drops-new-second-term-low.aspx",
      "created_at": "2025-11-28",
      "start_date": "2025-11-03",
      "end_date": "2025-11-25",
      "pollster": "Gallup",
      "answers": [
        {
          "choice": "Approve",
          "pct": 36
        },
        {
          "choice": "Disapprove",
          "pct": 60
        }
      ],
      "seat_name": null,
      "sponsors": [],
      "internal": false,
      "partisan": null,
      "subject": "Donald Trump"
    },
    {
      "id": "appdonthe6rwh050z",
      "poll_type": "approval",
      "sample_size": 1200,
      "population": "a",
      "url": "https://www.thebullfinchgroup.com/post/public-release-of-bullfinch-q4-nationwide-survey-3",
      "created_at": "2025-12-02",
      "start_date": "2025-11-21",
      "end_date": "2025-11-25",
      "pollster": "The Bullfinch Group",
      "answers": [
        {
          "choice": "Approve",
          "pct": 39
        },
        {
          "choice": "Disapprove",
          "pct": 54
        }
      ],
      "seat_name": null,
      "sponsors": [],
      "internal": false,
      "partisan": null,
      "subject": "Donald Trump"
    },
    {
      "id": "appdonthez97ml2zg",
      "poll_type": "approval",
      "sample_size": 1000,
      "population": "rv",
      "url": "https://www.thebullfinchgroup.com/post/public-release-of-bullfinch-q4-nationwide-survey-3",
      "created_at": "2025-12-02",
      "start_date": "2025-11-21",
      "end_date": "2025-11-25",
      "pollster": "The Bullfinch Group",
      "answers": [
        {
          "choice": "Approve",
          "pct": 40
        },
        {
          "choice": "Disapprove",
          "pct": 54
        }
      ],
      "seat_name": null,
      "sponsors": [],
      "internal": false,
      "partisan": null,
      "subject": "Donald Trump"
    },
    {
      "id": "appdonyoukv887sam",
      "poll_type": "approval",
      "sample_size": 1677,
      "population": "a",
      "url": "https://d3nkl3psvxxpe9.cloudfront.net/documents/econtoplines_t1cr1bJ.pdf",
      "created_at": "2025-11-25",
      "start_date": "2025-11-21",
      "end_date": "2025-11-24",
      "pollster": "YouGov",
      "answers": [
        {
          "choice": "Approve",
          "pct": 38
        },
        {
          "choice": "Disapprove",
          "pct": 57
        }
      ],
      "seat_name": null,
      "sponsors": [
        "The Economist"
      ],
      "internal": false,
      "partisan": null,
      "subject": "Donald Trump"
    },
    {
      "id": "appdonyouqqbup3j0",
      "poll_type": "approval",
      "sample_size": 1511,
      "population": "rv",
      "url": "https://d3nkl3psvxxpe9.cloudfront.net/documents/econtoplines_t1cr1bJ.pdf",
      "created_at": "2025-11-25",
      "start_date": "2025-11-21",
      "end_date": "2025-11-24",
      "pollster": "YouGov",
      "answers": [
        {
          "choice": "Approve",
          "pct": 43
        },
        {
          "choice": "Disapprove",
          "pct": 56
        }
      ],
      "seat_name": null,
      "sponsors": [
        "The Economist"
      ],
      "internal": false,
      "partisan": null,
      "subject": "Donald Trump"
    },
    {
      "id": "appdonyou6abj1htw",
      "poll_type": "approval",
      "sample_size": 1684,
      "population": "a",
      "url": "https://www.yahoo.com/news/politics/article/poll-only-25-of-americans-think-trump-has-followed-through-on-his-promise-to-release-the-epstein-files-192207619.html?guce_referrer=aHR0cHM6Ly90LmNvLw&guce_referrer_sig=AQAAAKHALBHJRz7c8dPOzHBUwkSVwV_hIl9ocAdwfeHzS6K4r9hCWqQubH82m6uGKcd3Sez2zK4cmHtPq2PJTDMuRFvDi4RPOMjYfZBFybZOKv8VAOiQUfzTqOIid3rlFsCHkvhUTBEK20sEwQrlUniwUixD2QaPq-6goxzO4j23cR2b&guccounter=2",
      "created_at": "2025-11-26",
      "start_date": "2025-11-20",
      "end_date": "2025-11-24",
      "pollster": "YouGov",
      "answers": [
        {
          "choice": "Approve",
          "pct": 40
        },
        {
          "choice": "Disapprove",
          "pct": 56
        }
      ],
      "seat_name": null,
      "sponsors": [
        "Yahoo News"
      ],
      "internal": false,
      "partisan": null,
      "subject": "Donald Trump"
    },
    {
      "id": "appdonyou2zugxjx3",
      "poll_type": "approval",
      "sample_size": 1132,
      "population": "rv",
      "url": "https://www.yahoo.com/news/politics/article/poll-only-25-of-americans-think-trump-has-followed-through-on-his-promise-to-release-the-epstein-files-192207619.html?guce_referrer=aHR0cHM6Ly90LmNvLw&guce_referrer_sig=AQAAAKHALBHJRz7c8dPOzHBUwkSVwV_hIl9ocAdwfeHzS6K4r9hCWqQubH82m6uGKcd3Sez2zK4cmHtPq2PJTDMuRFvDi4RPOMjYfZBFybZOKv8VAOiQUfzTqOIid3rlFsCHkvhUTBEK20sEwQrlUniwUixD2QaPq-6goxzO4j23cR2b&guccounter=2",
      "created_at": "2025-11-26",
      "start_date": "2025-11-20",
      "end_date": "2025-11-24",
      "pollster": "YouGov",
      "answers": [
        {
          "choice": "Approve",
          "pct": 44
        },
        {
          "choice": "Disapprove",
          "pct": 54
        }
      ],
      "seat_name": null,
      "sponsors": [
        "Yahoo News"
      ],
      "internal": false,
      "partisan": null,
      "subject": "Donald Trump"
    },
    {
      "id": "appdonmordkn93gg9",
      "poll_type": "approval",
      "sample_size": 2200,
      "population": "rv",
      "url": "https://pro.morningconsult.com/trackers/donald-trump-congress-policy-republicans-polling#11-23-2025",
      "created_at": "2025-11-25",
      "start_date": "2025-11-21",
      "end_date": "2025-11-23",
      "pollster": "Morning Consult",
      "answers": [
        {
          "choice": "Approve",
          "pct": 45
        },
        {
          "choice": "Disapprove",
          "pct": 52
        }
      ],
      "seat_name": null,
      "sponsors": [],
      "internal": false,
      "partisan": null,
      "subject": "Donald Trump"
    },
    {
      "id": "appdonyouhyfmdy15",
      "poll_type": "approval",
      "sample_size": 2489,
      "population": "a",
      "url": "https://www.scribd.com/document/953800077/cbsnews-20251123-SUN#from_embed",
      "created_at": "2025-11-23",
      "start_date": "2025-11-19",
      "end_date": "2025-11-21",
      "pollster": "YouGov",
      "answers": [
        {
          "choice": "Approve",
          "pct": 40
        },
        {
          "choice": "Disapprove",
          "pct": 60
        }
      ],
      "seat_name": null,
      "sponsors": [
        "CBS News"
      ],
      "internal": false,
      "partisan": null,
      "subject": "Donald Trump"
    },
    {
      "id": "appdoninswpfgycmr",
      "poll_type": "approval",
      "sample_size": 800,
      "population": "lv",
      "url": "https://insideradvantage.com/insideradvantage-national-survey-trump-approval-recovering-approve-44-disapprove-49/",
      "created_at": "2025-11-24",
      "start_date": "2025-11-20",
      "end_date": "2025-11-21",
      "pollster": "InsiderAdvantage",
      "answers": [
        {
          "choice": "Approve",
          "pct": 44
        },
        {
          "choice": "Disapprove",
          "pct": 49
        }
      ],
      "seat_name": null,
      "sponsors": [],
      "internal": false,
      "partisan": null,
      "subject": "Donald Trump"
    },
    {
      "id": "appdonbigg39uc6u9",
      "poll_type": "approval",
      "sample_size": 2005,
